
****** Vivado v2021.2 (64-bit)
  **** SW Build 3367213 on Tue Oct 19 02:47:39 MDT 2021
  **** IP Build 3369179 on Thu Oct 21 08:25:16 MDT 2021
    ** Copyright 1986-2021 Xilinx, Inc. All Rights Reserved.

source /home/users/aram/Workspace/yosys_verific_rs/result_10-06-2022T20-03-24/Golden_vivado_diff.json/cf_rca_16/vivado_script.tcl
# set_param general.maxThreads 1
# add_files -norecurse /home/users/aram/Workspace/yosys_verific_rs/result_10-06-2022T20-03-24/Golden_vivado_diff.json/cf_rca_16
add_files: Time (s): cpu = 00:00:09 ; elapsed = 00:00:09 . Memory (MB): peak = 2852.344 ; gain = 2.016 ; free physical = 52648 ; free virtual = 379929
# if {[glob -nocomplain -directory "/home/users/aram/Workspace/yosys_verific_rs/result_10-06-2022T20-03-24/Golden_vivado_diff.json/cf_rca_16" "*.vh"] != ""} {
#   set_property is_global_include true [get_files [glob -nocomplain -directory "/home/users/aram/Workspace/yosys_verific_rs/result_10-06-2022T20-03-24/Golden_vivado_diff.json/cf_rca_16" "*.vh"]] 
# }
# if {[glob -nocomplain -directory "/home/users/aram/Workspace/yosys_verific_rs/result_10-06-2022T20-03-24/Golden_vivado_diff.json/cf_rca_16" "*.svh"] != ""} {
#   set_property is_global_include true [get_files [glob -nocomplain -directory "/home/users/aram/Workspace/yosys_verific_rs/result_10-06-2022T20-03-24/Golden_vivado_diff.json/cf_rca_16" "*.svh"]] 
# }
# synth_design -top top \
#     -part xc7a100tfgg676-1 \
#     -flatten_hierarchy rebuilt \
#     -gated_clock_conversion off \
#     -bufg 12 \
#     -directive AreaOptimized_high \
#     -fanout_limit 400 \
#     -no_lc \
#     -fsm_extraction auto \
#     -keep_equivalent_registers \
#     -resource_sharing off \
#     -cascade_dsp auto \
#     -control_set_opt_threshold auto \
#     -max_bram 0 \
#     -max_uram 0 \
#     -max_dsp 0 \
#     -max_bram_cascade_height 0 \
#     -max_uram_cascade_height 0 \
#     -shreg_min_size 5
Command: synth_design -top top -part xc7a100tfgg676-1 -flatten_hierarchy rebuilt -gated_clock_conversion off -bufg 12 -directive AreaOptimized_high -fanout_limit 400 -no_lc -fsm_extraction auto -keep_equivalent_registers -resource_sharing off -cascade_dsp auto -control_set_opt_threshold auto -max_bram 0 -max_uram 0 -max_dsp 0 -max_bram_cascade_height 0 -max_uram_cascade_height 0 -shreg_min_size 5
Starting synth_design
Attempting to get a license for feature 'Synthesis' and/or device 'xc7a100t'
INFO: [Common 17-349] Got license for feature 'Synthesis' and/or device 'xc7a100t'
INFO: [Vivado_Tcl 4-288] User specified maximum number of block RAM allowed in design is 0
INFO: [Vivado_Tcl 4-551] User specified maximum number of Ultra RAM blocks allowed in design is 0
INFO: [Vivado_Tcl 4-287] User specified maximum number of block DSP allowed in design is 0
INFO: [Vivado_Tcl 4-549] User specified maximum number of BRAM that can be cascaded is 0
INFO: [Vivado_Tcl 4-550] User specified maximum number of URAM that can be cascaded is 0
INFO: [Synth 8-7079] Multithreading enabled for synth_design using a maximum of 1 processes.
INFO: [Synth 8-7078] Launching helper process for spawning children vivado processes
INFO: [Synth 8-7075] Helper process launched with PID 49269
---------------------------------------------------------------------------------
Starting Synthesize : Time (s): cpu = 00:00:08 ; elapsed = 00:00:09 . Memory (MB): peak = 2852.492 ; gain = 0.000 ; free physical = 45043 ; free virtual = 372329
---------------------------------------------------------------------------------
INFO: [Synth 8-6157] synthesizing module 'top' [/home/users/aram/Workspace/yosys_verific_rs/result_10-06-2022T20-03-24/Golden_vivado_diff.json/cf_rca_16/cf_rca_16.v:75]
INFO: [Synth 8-6157] synthesizing module 'cf_rca_16_1' [/home/users/aram/Workspace/yosys_verific_rs/result_10-06-2022T20-03-24/Golden_vivado_diff.json/cf_rca_16/cf_rca_16.v:100]
INFO: [Synth 8-6157] synthesizing module 'cf_rca_16_38' [/home/users/aram/Workspace/yosys_verific_rs/result_10-06-2022T20-03-24/Golden_vivado_diff.json/cf_rca_16/cf_rca_16.v:5965]
INFO: [Synth 8-6155] done synthesizing module 'cf_rca_16_38' (1#1) [/home/users/aram/Workspace/yosys_verific_rs/result_10-06-2022T20-03-24/Golden_vivado_diff.json/cf_rca_16/cf_rca_16.v:5965]
INFO: [Synth 8-6157] synthesizing module 'cf_rca_16_32' [/home/users/aram/Workspace/yosys_verific_rs/result_10-06-2022T20-03-24/Golden_vivado_diff.json/cf_rca_16/cf_rca_16.v:5646]
INFO: [Synth 8-6157] synthesizing module 'cf_rca_16_33' [/home/users/aram/Workspace/yosys_verific_rs/result_10-06-2022T20-03-24/Golden_vivado_diff.json/cf_rca_16/cf_rca_16.v:5701]
INFO: [Synth 8-6157] synthesizing module 'cf_rca_16_34' [/home/users/aram/Workspace/yosys_verific_rs/result_10-06-2022T20-03-24/Golden_vivado_diff.json/cf_rca_16/cf_rca_16.v:5756]
INFO: [Synth 8-6157] synthesizing module 'cf_rca_16_35' [/home/users/aram/Workspace/yosys_verific_rs/result_10-06-2022T20-03-24/Golden_vivado_diff.json/cf_rca_16/cf_rca_16.v:5811]
INFO: [Synth 8-6157] synthesizing module 'cf_rca_16_36' [/home/users/aram/Workspace/yosys_verific_rs/result_10-06-2022T20-03-24/Golden_vivado_diff.json/cf_rca_16/cf_rca_16.v:5866]
INFO: [Synth 8-6157] synthesizing module 'cf_rca_16_37' [/home/users/aram/Workspace/yosys_verific_rs/result_10-06-2022T20-03-24/Golden_vivado_diff.json/cf_rca_16/cf_rca_16.v:5916]
INFO: [Synth 8-6155] done synthesizing module 'cf_rca_16_37' (2#1) [/home/users/aram/Workspace/yosys_verific_rs/result_10-06-2022T20-03-24/Golden_vivado_diff.json/cf_rca_16/cf_rca_16.v:5916]
INFO: [Synth 8-6155] done synthesizing module 'cf_rca_16_36' (3#1) [/home/users/aram/Workspace/yosys_verific_rs/result_10-06-2022T20-03-24/Golden_vivado_diff.json/cf_rca_16/cf_rca_16.v:5866]
INFO: [Synth 8-6155] done synthesizing module 'cf_rca_16_35' (4#1) [/home/users/aram/Workspace/yosys_verific_rs/result_10-06-2022T20-03-24/Golden_vivado_diff.json/cf_rca_16/cf_rca_16.v:5811]
INFO: [Synth 8-6155] done synthesizing module 'cf_rca_16_34' (5#1) [/home/users/aram/Workspace/yosys_verific_rs/result_10-06-2022T20-03-24/Golden_vivado_diff.json/cf_rca_16/cf_rca_16.v:5756]
INFO: [Synth 8-6155] done synthesizing module 'cf_rca_16_33' (6#1) [/home/users/aram/Workspace/yosys_verific_rs/result_10-06-2022T20-03-24/Golden_vivado_diff.json/cf_rca_16/cf_rca_16.v:5701]
INFO: [Synth 8-6155] done synthesizing module 'cf_rca_16_32' (7#1) [/home/users/aram/Workspace/yosys_verific_rs/result_10-06-2022T20-03-24/Golden_vivado_diff.json/cf_rca_16/cf_rca_16.v:5646]
INFO: [Synth 8-6157] synthesizing module 'cf_rca_16_2' [/home/users/aram/Workspace/yosys_verific_rs/result_10-06-2022T20-03-24/Golden_vivado_diff.json/cf_rca_16/cf_rca_16.v:165]
INFO: [Synth 8-6157] synthesizing module 'cf_rca_16_22' [/home/users/aram/Workspace/yosys_verific_rs/result_10-06-2022T20-03-24/Golden_vivado_diff.json/cf_rca_16/cf_rca_16.v:3129]
INFO: [Synth 8-6157] synthesizing module 'cf_rca_16_23' [/home/users/aram/Workspace/yosys_verific_rs/result_10-06-2022T20-03-24/Golden_vivado_diff.json/cf_rca_16/cf_rca_16.v:3273]
INFO: [Synth 8-6157] synthesizing module 'cf_rca_16_24' [/home/users/aram/Workspace/yosys_verific_rs/result_10-06-2022T20-03-24/Golden_vivado_diff.json/cf_rca_16/cf_rca_16.v:3405]
INFO: [Synth 8-6157] synthesizing module 'cf_rca_16_25' [/home/users/aram/Workspace/yosys_verific_rs/result_10-06-2022T20-03-24/Golden_vivado_diff.json/cf_rca_16/cf_rca_16.v:3525]
INFO: [Synth 8-6157] synthesizing module 'cf_rca_16_26' [/home/users/aram/Workspace/yosys_verific_rs/result_10-06-2022T20-03-24/Golden_vivado_diff.json/cf_rca_16/cf_rca_16.v:3633]
INFO: [Synth 8-6157] synthesizing module 'cf_rca_16_27' [/home/users/aram/Workspace/yosys_verific_rs/result_10-06-2022T20-03-24/Golden_vivado_diff.json/cf_rca_16/cf_rca_16.v:3729]
INFO: [Synth 8-6157] synthesizing module 'cf_rca_16_28' [/home/users/aram/Workspace/yosys_verific_rs/result_10-06-2022T20-03-24/Golden_vivado_diff.json/cf_rca_16/cf_rca_16.v:3813]
INFO: [Synth 8-6157] synthesizing module 'cf_rca_16_30' [/home/users/aram/Workspace/yosys_verific_rs/result_10-06-2022T20-03-24/Golden_vivado_diff.json/cf_rca_16/cf_rca_16.v:4745]
INFO: [Synth 8-6157] synthesizing module 'cf_rca_16_31' [/home/users/aram/Workspace/yosys_verific_rs/result_10-06-2022T20-03-24/Golden_vivado_diff.json/cf_rca_16/cf_rca_16.v:5599]
INFO: [Synth 8-6155] done synthesizing module 'cf_rca_16_31' (8#1) [/home/users/aram/Workspace/yosys_verific_rs/result_10-06-2022T20-03-24/Golden_vivado_diff.json/cf_rca_16/cf_rca_16.v:5599]
INFO: [Synth 8-6155] done synthesizing module 'cf_rca_16_30' (9#1) [/home/users/aram/Workspace/yosys_verific_rs/result_10-06-2022T20-03-24/Golden_vivado_diff.json/cf_rca_16/cf_rca_16.v:4745]
INFO: [Synth 8-6157] synthesizing module 'cf_rca_16_29' [/home/users/aram/Workspace/yosys_verific_rs/result_10-06-2022T20-03-24/Golden_vivado_diff.json/cf_rca_16/cf_rca_16.v:3891]
INFO: [Synth 8-6155] done synthesizing module 'cf_rca_16_29' (10#1) [/home/users/aram/Workspace/yosys_verific_rs/result_10-06-2022T20-03-24/Golden_vivado_diff.json/cf_rca_16/cf_rca_16.v:3891]
INFO: [Synth 8-6155] done synthesizing module 'cf_rca_16_28' (11#1) [/home/users/aram/Workspace/yosys_verific_rs/result_10-06-2022T20-03-24/Golden_vivado_diff.json/cf_rca_16/cf_rca_16.v:3813]
INFO: [Synth 8-6155] done synthesizing module 'cf_rca_16_27' (12#1) [/home/users/aram/Workspace/yosys_verific_rs/result_10-06-2022T20-03-24/Golden_vivado_diff.json/cf_rca_16/cf_rca_16.v:3729]
INFO: [Synth 8-6155] done synthesizing module 'cf_rca_16_26' (13#1) [/home/users/aram/Workspace/yosys_verific_rs/result_10-06-2022T20-03-24/Golden_vivado_diff.json/cf_rca_16/cf_rca_16.v:3633]
INFO: [Synth 8-6155] done synthesizing module 'cf_rca_16_25' (14#1) [/home/users/aram/Workspace/yosys_verific_rs/result_10-06-2022T20-03-24/Golden_vivado_diff.json/cf_rca_16/cf_rca_16.v:3525]
INFO: [Synth 8-6155] done synthesizing module 'cf_rca_16_24' (15#1) [/home/users/aram/Workspace/yosys_verific_rs/result_10-06-2022T20-03-24/Golden_vivado_diff.json/cf_rca_16/cf_rca_16.v:3405]
INFO: [Synth 8-6155] done synthesizing module 'cf_rca_16_23' (16#1) [/home/users/aram/Workspace/yosys_verific_rs/result_10-06-2022T20-03-24/Golden_vivado_diff.json/cf_rca_16/cf_rca_16.v:3273]
INFO: [Synth 8-6155] done synthesizing module 'cf_rca_16_22' (17#1) [/home/users/aram/Workspace/yosys_verific_rs/result_10-06-2022T20-03-24/Golden_vivado_diff.json/cf_rca_16/cf_rca_16.v:3129]
INFO: [Synth 8-6157] synthesizing module 'cf_rca_16_3' [/home/users/aram/Workspace/yosys_verific_rs/result_10-06-2022T20-03-24/Golden_vivado_diff.json/cf_rca_16/cf_rca_16.v:342]
INFO: [Synth 8-6157] synthesizing module 'cf_rca_16_4' [/home/users/aram/Workspace/yosys_verific_rs/result_10-06-2022T20-03-24/Golden_vivado_diff.json/cf_rca_16/cf_rca_16.v:516]
INFO: [Synth 8-6157] synthesizing module 'cf_rca_16_5' [/home/users/aram/Workspace/yosys_verific_rs/result_10-06-2022T20-03-24/Golden_vivado_diff.json/cf_rca_16/cf_rca_16.v:687]
INFO: [Synth 8-6157] synthesizing module 'cf_rca_16_6' [/home/users/aram/Workspace/yosys_verific_rs/result_10-06-2022T20-03-24/Golden_vivado_diff.json/cf_rca_16/cf_rca_16.v:855]
INFO: [Synth 8-6157] synthesizing module 'cf_rca_16_7' [/home/users/aram/Workspace/yosys_verific_rs/result_10-06-2022T20-03-24/Golden_vivado_diff.json/cf_rca_16/cf_rca_16.v:1020]
INFO: [Synth 8-6157] synthesizing module 'cf_rca_16_8' [/home/users/aram/Workspace/yosys_verific_rs/result_10-06-2022T20-03-24/Golden_vivado_diff.json/cf_rca_16/cf_rca_16.v:1182]
INFO: [Synth 8-6157] synthesizing module 'cf_rca_16_9' [/home/users/aram/Workspace/yosys_verific_rs/result_10-06-2022T20-03-24/Golden_vivado_diff.json/cf_rca_16/cf_rca_16.v:1341]
INFO: [Synth 8-6157] synthesizing module 'cf_rca_16_10' [/home/users/aram/Workspace/yosys_verific_rs/result_10-06-2022T20-03-24/Golden_vivado_diff.json/cf_rca_16/cf_rca_16.v:1497]
INFO: [Synth 8-6157] synthesizing module 'cf_rca_16_11' [/home/users/aram/Workspace/yosys_verific_rs/result_10-06-2022T20-03-24/Golden_vivado_diff.json/cf_rca_16/cf_rca_16.v:1650]
INFO: [Synth 8-6157] synthesizing module 'cf_rca_16_18' [/home/users/aram/Workspace/yosys_verific_rs/result_10-06-2022T20-03-24/Golden_vivado_diff.json/cf_rca_16/cf_rca_16.v:2625]
INFO: [Synth 8-6157] synthesizing module 'cf_rca_16_19' [/home/users/aram/Workspace/yosys_verific_rs/result_10-06-2022T20-03-24/Golden_vivado_diff.json/cf_rca_16/cf_rca_16.v:2769]
INFO: [Synth 8-6157] synthesizing module 'cf_rca_16_20' [/home/users/aram/Workspace/yosys_verific_rs/result_10-06-2022T20-03-24/Golden_vivado_diff.json/cf_rca_16/cf_rca_16.v:2901]
INFO: [Synth 8-6157] synthesizing module 'cf_rca_16_21' [/home/users/aram/Workspace/yosys_verific_rs/result_10-06-2022T20-03-24/Golden_vivado_diff.json/cf_rca_16/cf_rca_16.v:3021]
INFO: [Synth 8-6155] done synthesizing module 'cf_rca_16_21' (18#1) [/home/users/aram/Workspace/yosys_verific_rs/result_10-06-2022T20-03-24/Golden_vivado_diff.json/cf_rca_16/cf_rca_16.v:3021]
INFO: [Synth 8-6155] done synthesizing module 'cf_rca_16_20' (19#1) [/home/users/aram/Workspace/yosys_verific_rs/result_10-06-2022T20-03-24/Golden_vivado_diff.json/cf_rca_16/cf_rca_16.v:2901]
INFO: [Synth 8-6155] done synthesizing module 'cf_rca_16_19' (20#1) [/home/users/aram/Workspace/yosys_verific_rs/result_10-06-2022T20-03-24/Golden_vivado_diff.json/cf_rca_16/cf_rca_16.v:2769]
INFO: [Synth 8-6155] done synthesizing module 'cf_rca_16_18' (21#1) [/home/users/aram/Workspace/yosys_verific_rs/result_10-06-2022T20-03-24/Golden_vivado_diff.json/cf_rca_16/cf_rca_16.v:2625]
INFO: [Synth 8-6157] synthesizing module 'cf_rca_16_12' [/home/users/aram/Workspace/yosys_verific_rs/result_10-06-2022T20-03-24/Golden_vivado_diff.json/cf_rca_16/cf_rca_16.v:1800]
INFO: [Synth 8-6157] synthesizing module 'cf_rca_16_13' [/home/users/aram/Workspace/yosys_verific_rs/result_10-06-2022T20-03-24/Golden_vivado_diff.json/cf_rca_16/cf_rca_16.v:1947]
INFO: [Synth 8-6157] synthesizing module 'cf_rca_16_14' [/home/users/aram/Workspace/yosys_verific_rs/result_10-06-2022T20-03-24/Golden_vivado_diff.json/cf_rca_16/cf_rca_16.v:2091]
INFO: [Synth 8-6157] synthesizing module 'cf_rca_16_15' [/home/users/aram/Workspace/yosys_verific_rs/result_10-06-2022T20-03-24/Golden_vivado_diff.json/cf_rca_16/cf_rca_16.v:2232]
INFO: [Synth 8-6157] synthesizing module 'cf_rca_16_16' [/home/users/aram/Workspace/yosys_verific_rs/result_10-06-2022T20-03-24/Golden_vivado_diff.json/cf_rca_16/cf_rca_16.v:2370]
INFO: [Synth 8-6157] synthesizing module 'cf_rca_16_17' [/home/users/aram/Workspace/yosys_verific_rs/result_10-06-2022T20-03-24/Golden_vivado_diff.json/cf_rca_16/cf_rca_16.v:2505]
INFO: [Synth 8-6155] done synthesizing module 'cf_rca_16_17' (22#1) [/home/users/aram/Workspace/yosys_verific_rs/result_10-06-2022T20-03-24/Golden_vivado_diff.json/cf_rca_16/cf_rca_16.v:2505]
INFO: [Synth 8-6155] done synthesizing module 'cf_rca_16_16' (23#1) [/home/users/aram/Workspace/yosys_verific_rs/result_10-06-2022T20-03-24/Golden_vivado_diff.json/cf_rca_16/cf_rca_16.v:2370]
INFO: [Synth 8-6155] done synthesizing module 'cf_rca_16_15' (24#1) [/home/users/aram/Workspace/yosys_verific_rs/result_10-06-2022T20-03-24/Golden_vivado_diff.json/cf_rca_16/cf_rca_16.v:2232]
INFO: [Synth 8-6155] done synthesizing module 'cf_rca_16_14' (25#1) [/home/users/aram/Workspace/yosys_verific_rs/result_10-06-2022T20-03-24/Golden_vivado_diff.json/cf_rca_16/cf_rca_16.v:2091]
INFO: [Synth 8-6155] done synthesizing module 'cf_rca_16_13' (26#1) [/home/users/aram/Workspace/yosys_verific_rs/result_10-06-2022T20-03-24/Golden_vivado_diff.json/cf_rca_16/cf_rca_16.v:1947]
INFO: [Synth 8-6155] done synthesizing module 'cf_rca_16_12' (27#1) [/home/users/aram/Workspace/yosys_verific_rs/result_10-06-2022T20-03-24/Golden_vivado_diff.json/cf_rca_16/cf_rca_16.v:1800]
INFO: [Synth 8-6155] done synthesizing module 'cf_rca_16_11' (28#1) [/home/users/aram/Workspace/yosys_verific_rs/result_10-06-2022T20-03-24/Golden_vivado_diff.json/cf_rca_16/cf_rca_16.v:1650]
INFO: [Synth 8-6155] done synthesizing module 'cf_rca_16_10' (29#1) [/home/users/aram/Workspace/yosys_verific_rs/result_10-06-2022T20-03-24/Golden_vivado_diff.json/cf_rca_16/cf_rca_16.v:1497]
INFO: [Synth 8-6155] done synthesizing module 'cf_rca_16_9' (30#1) [/home/users/aram/Workspace/yosys_verific_rs/result_10-06-2022T20-03-24/Golden_vivado_diff.json/cf_rca_16/cf_rca_16.v:1341]
INFO: [Synth 8-6155] done synthesizing module 'cf_rca_16_8' (31#1) [/home/users/aram/Workspace/yosys_verific_rs/result_10-06-2022T20-03-24/Golden_vivado_diff.json/cf_rca_16/cf_rca_16.v:1182]
INFO: [Synth 8-6155] done synthesizing module 'cf_rca_16_7' (32#1) [/home/users/aram/Workspace/yosys_verific_rs/result_10-06-2022T20-03-24/Golden_vivado_diff.json/cf_rca_16/cf_rca_16.v:1020]
INFO: [Synth 8-6155] done synthesizing module 'cf_rca_16_6' (33#1) [/home/users/aram/Workspace/yosys_verific_rs/result_10-06-2022T20-03-24/Golden_vivado_diff.json/cf_rca_16/cf_rca_16.v:855]
INFO: [Synth 8-6155] done synthesizing module 'cf_rca_16_5' (34#1) [/home/users/aram/Workspace/yosys_verific_rs/result_10-06-2022T20-03-24/Golden_vivado_diff.json/cf_rca_16/cf_rca_16.v:687]
INFO: [Synth 8-6155] done synthesizing module 'cf_rca_16_4' (35#1) [/home/users/aram/Workspace/yosys_verific_rs/result_10-06-2022T20-03-24/Golden_vivado_diff.json/cf_rca_16/cf_rca_16.v:516]
INFO: [Synth 8-6155] done synthesizing module 'cf_rca_16_3' (36#1) [/home/users/aram/Workspace/yosys_verific_rs/result_10-06-2022T20-03-24/Golden_vivado_diff.json/cf_rca_16/cf_rca_16.v:342]
INFO: [Synth 8-6155] done synthesizing module 'cf_rca_16_2' (37#1) [/home/users/aram/Workspace/yosys_verific_rs/result_10-06-2022T20-03-24/Golden_vivado_diff.json/cf_rca_16/cf_rca_16.v:165]
INFO: [Synth 8-6155] done synthesizing module 'cf_rca_16_1' (38#1) [/home/users/aram/Workspace/yosys_verific_rs/result_10-06-2022T20-03-24/Golden_vivado_diff.json/cf_rca_16/cf_rca_16.v:100]
INFO: [Synth 8-6155] done synthesizing module 'top' (39#1) [/home/users/aram/Workspace/yosys_verific_rs/result_10-06-2022T20-03-24/Golden_vivado_diff.json/cf_rca_16/cf_rca_16.v:75]
---------------------------------------------------------------------------------
Finished Synthesize : Time (s): cpu = 00:00:12 ; elapsed = 00:00:13 . Memory (MB): peak = 2852.492 ; gain = 0.000 ; free physical = 47807 ; free virtual = 375090
---------------------------------------------------------------------------------
---------------------------------------------------------------------------------
Finished Constraint Validation : Time (s): cpu = 00:00:13 ; elapsed = 00:00:14 . Memory (MB): peak = 2852.492 ; gain = 0.000 ; free physical = 48593 ; free virtual = 375879
---------------------------------------------------------------------------------
---------------------------------------------------------------------------------
Start Loading Part and Timing Information
---------------------------------------------------------------------------------
Loading part: xc7a100tfgg676-1
INFO: [Device 21-403] Loading part xc7a100tfgg676-1
---------------------------------------------------------------------------------
Finished Loading Part and Timing Information : Time (s): cpu = 00:00:13 ; elapsed = 00:00:14 . Memory (MB): peak = 2860.352 ; gain = 7.859 ; free physical = 48622 ; free virtual = 375913
---------------------------------------------------------------------------------
---------------------------------------------------------------------------------
Finished RTL Optimization Phase 2 : Time (s): cpu = 00:00:23 ; elapsed = 00:00:21 . Memory (MB): peak = 2860.355 ; gain = 7.863 ; free physical = 48237 ; free virtual = 375565
---------------------------------------------------------------------------------
No constraint files found.
---------------------------------------------------------------------------------
Start RTL Component Statistics 
---------------------------------------------------------------------------------
Detailed RTL Component Info : 
+---Registers : 
	               18 Bit    Registers := 1024  
	                1 Bit    Registers := 2048  
+---Muxes : 
	   2 Input   16 Bit        Muxes := 85    
	   6 Input   16 Bit        Muxes := 85    
	   2 Input    1 Bit        Muxes := 29696 
---------------------------------------------------------------------------------
Finished RTL Component Statistics 
---------------------------------------------------------------------------------
---------------------------------------------------------------------------------
Start Part Resource Summary
---------------------------------------------------------------------------------
Part Resources:
DSPs: 240 (col length:80)
BRAMs: 270 (col length: RAMB18 80 RAMB36 40)
---------------------------------------------------------------------------------
Finished Part Resource Summary
---------------------------------------------------------------------------------
No constraint files found.
---------------------------------------------------------------------------------
Start Cross Boundary and Area Optimization
---------------------------------------------------------------------------------
WARNING: [Synth 8-7080] Parallel synthesis criteria is not met
---------------------------------------------------------------------------------
Finished Cross Boundary and Area Optimization : Time (s): cpu = 00:07:16 ; elapsed = 00:09:34 . Memory (MB): peak = 3100.953 ; gain = 248.461 ; free physical = 58566 ; free virtual = 385926
---------------------------------------------------------------------------------
No constraint files found.
---------------------------------------------------------------------------------
Start Timing Optimization
---------------------------------------------------------------------------------
---------------------------------------------------------------------------------
Finished Timing Optimization : Time (s): cpu = 00:07:17 ; elapsed = 00:09:35 . Memory (MB): peak = 3103.926 ; gain = 251.434 ; free physical = 58450 ; free virtual = 385812
---------------------------------------------------------------------------------
---------------------------------------------------------------------------------
Start Technology Mapping
---------------------------------------------------------------------------------
---------------------------------------------------------------------------------
Finished Technology Mapping : Time (s): cpu = 00:07:26 ; elapsed = 00:09:44 . Memory (MB): peak = 3113.578 ; gain = 261.086 ; free physical = 58662 ; free virtual = 386025
---------------------------------------------------------------------------------
---------------------------------------------------------------------------------
Start IO Insertion
---------------------------------------------------------------------------------
---------------------------------------------------------------------------------
Start Flattening Before IO Insertion
---------------------------------------------------------------------------------
---------------------------------------------------------------------------------
Finished Flattening Before IO Insertion
---------------------------------------------------------------------------------
---------------------------------------------------------------------------------
Start Final Netlist Cleanup
---------------------------------------------------------------------------------
WARNING: synth_design option "-fanout_limit" is deprecated.
---------------------------------------------------------------------------------
Finished Final Netlist Cleanup
---------------------------------------------------------------------------------
---------------------------------------------------------------------------------
Finished IO Insertion : Time (s): cpu = 00:07:33 ; elapsed = 00:09:52 . Memory (MB): peak = 3113.582 ; gain = 261.090 ; free physical = 58076 ; free virtual = 385442
---------------------------------------------------------------------------------
---------------------------------------------------------------------------------
Start Renaming Generated Instances
---------------------------------------------------------------------------------
---------------------------------------------------------------------------------
Finished Renaming Generated Instances : Time (s): cpu = 00:07:33 ; elapsed = 00:09:52 . Memory (MB): peak = 3113.582 ; gain = 261.090 ; free physical = 58171 ; free virtual = 385537
---------------------------------------------------------------------------------
---------------------------------------------------------------------------------
Start Rebuilding User Hierarchy
---------------------------------------------------------------------------------
---------------------------------------------------------------------------------
Finished Rebuilding User Hierarchy : Time (s): cpu = 00:07:43 ; elapsed = 00:10:02 . Memory (MB): peak = 3113.582 ; gain = 261.090 ; free physical = 57949 ; free virtual = 385321
---------------------------------------------------------------------------------
---------------------------------------------------------------------------------
Start Renaming Generated Ports
---------------------------------------------------------------------------------
---------------------------------------------------------------------------------
Finished Renaming Generated Ports : Time (s): cpu = 00:07:43 ; elapsed = 00:10:02 . Memory (MB): peak = 3113.582 ; gain = 261.090 ; free physical = 57890 ; free virtual = 385262
---------------------------------------------------------------------------------
---------------------------------------------------------------------------------
Start Handling Custom Attributes
---------------------------------------------------------------------------------
---------------------------------------------------------------------------------
Finished Handling Custom Attributes : Time (s): cpu = 00:07:44 ; elapsed = 00:10:03 . Memory (MB): peak = 3113.582 ; gain = 261.090 ; free physical = 57850 ; free virtual = 385220
---------------------------------------------------------------------------------
---------------------------------------------------------------------------------
Start Renaming Generated Nets
---------------------------------------------------------------------------------
---------------------------------------------------------------------------------
Finished Renaming Generated Nets : Time (s): cpu = 00:07:44 ; elapsed = 00:10:03 . Memory (MB): peak = 3113.582 ; gain = 261.090 ; free physical = 57822 ; free virtual = 385192
---------------------------------------------------------------------------------
---------------------------------------------------------------------------------
Start Writing Synthesis Report
---------------------------------------------------------------------------------

Report BlackBoxes: 
+-+--------------+----------+
| |BlackBox name |Instances |
+-+--------------+----------+
+-+--------------+----------+

Report Cell Usage: 
+------+------+------+
|      |Cell  |Count |
+------+------+------+
|1     |BUFG  |     2|
|2     |LUT3  |  1391|
|3     |LUT5  |   794|
|4     |LUT6  |  8192|
|5     |MUXF7 |  4096|
|6     |FDRE  | 20480|
|7     |IBUF  |    95|
|8     |OBUF  |    64|
+------+------+------+

Report Instance Areas: 
+------+------------------------------------------------------+-----------------+------+
|      |Instance                                              |Module           |Cells |
+------+------------------------------------------------------+-----------------+------+
|1     |top                                                   |                 | 35114|
|2     |  s1                                                  |cf_rca_16_1      | 34953|
|3     |    s10                                               |cf_rca_16_2      | 33849|
|4     |      s21                                             |cf_rca_16_22     |  1980|
|5     |        s17                                           |cf_rca_16_23_334 |  1716|
|6     |          s17                                         |cf_rca_16_24_337 |  1452|
|7     |            s17                                       |cf_rca_16_25_340 |  1188|
|8     |              s17                                     |cf_rca_16_26_343 |   924|
|9     |                s17                                   |cf_rca_16_27_346 |   660|
|10    |                  s17                                 |cf_rca_16_28_349 |   396|
|11    |                    s20                               |cf_rca_16_30_352 |   132|
|12    |                    s21                               |cf_rca_16_29_353 |   132|
|13    |                    s22                               |cf_rca_16_29_354 |   132|
|14    |                  s18                                 |cf_rca_16_29_350 |   132|
|15    |                  s19                                 |cf_rca_16_29_351 |   132|
|16    |                s18                                   |cf_rca_16_29_347 |   132|
|17    |                s19                                   |cf_rca_16_29_348 |   132|
|18    |              s18                                     |cf_rca_16_29_344 |   132|
|19    |              s19                                     |cf_rca_16_29_345 |   132|
|20    |            s18                                       |cf_rca_16_29_341 |   132|
|21    |            s19                                       |cf_rca_16_29_342 |   132|
|22    |          s18                                         |cf_rca_16_29_338 |   132|
|23    |          s19                                         |cf_rca_16_29_339 |   132|
|24    |        s18                                           |cf_rca_16_29_335 |   132|
|25    |        s19                                           |cf_rca_16_29_336 |   132|
|26    |      s22                                             |cf_rca_16_29     |   132|
|27    |      s23                                             |cf_rca_16_3      | 31737|
|28    |        s21                                           |cf_rca_16_22_0   |  1980|
|29    |          s17                                         |cf_rca_16_23_313 |  1716|
|30    |            s17                                       |cf_rca_16_24_316 |  1452|
|31    |              s17                                     |cf_rca_16_25_319 |  1188|
|32    |                s17                                   |cf_rca_16_26_322 |   924|
|33    |                  s17                                 |cf_rca_16_27_325 |   660|
|34    |                    s17                               |cf_rca_16_28_328 |   396|
|35    |                      s20                             |cf_rca_16_30_331 |   132|
|36    |                      s21                             |cf_rca_16_29_332 |   132|
|37    |                      s22                             |cf_rca_16_29_333 |   132|
|38    |                    s18                               |cf_rca_16_29_329 |   132|
|39    |                    s19                               |cf_rca_16_29_330 |   132|
|40    |                  s18                                 |cf_rca_16_29_326 |   132|
|41    |                  s19                                 |cf_rca_16_29_327 |   132|
|42    |                s18                                   |cf_rca_16_29_323 |   132|
|43    |                s19                                   |cf_rca_16_29_324 |   132|
|44    |              s18                                     |cf_rca_16_29_320 |   132|
|45    |              s19                                     |cf_rca_16_29_321 |   132|
|46    |            s18                                       |cf_rca_16_29_317 |   132|
|47    |            s19                                       |cf_rca_16_29_318 |   132|
|48    |          s18                                         |cf_rca_16_29_314 |   132|
|49    |          s19                                         |cf_rca_16_29_315 |   132|
|50    |        s22                                           |cf_rca_16_29_1   |   132|
|51    |        s23                                           |cf_rca_16_4      | 29625|
|52    |          s21                                         |cf_rca_16_22_2   |  1980|
|53    |            s17                                       |cf_rca_16_23_292 |  1716|
|54    |              s17                                     |cf_rca_16_24_295 |  1452|
|55    |                s17                                   |cf_rca_16_25_298 |  1188|
|56    |                  s17                                 |cf_rca_16_26_301 |   924|
|57    |                    s17                               |cf_rca_16_27_304 |   660|
|58    |                      s17                             |cf_rca_16_28_307 |   396|
|59    |                        s20                           |cf_rca_16_30_310 |   132|
|60    |                        s21                           |cf_rca_16_29_311 |   132|
|61    |                        s22                           |cf_rca_16_29_312 |   132|
|62    |                      s18                             |cf_rca_16_29_308 |   132|
|63    |                      s19                             |cf_rca_16_29_309 |   132|
|64    |                    s18                               |cf_rca_16_29_305 |   132|
|65    |                    s19                               |cf_rca_16_29_306 |   132|
|66    |                  s18                                 |cf_rca_16_29_302 |   132|
|67    |                  s19                                 |cf_rca_16_29_303 |   132|
|68    |                s18                                   |cf_rca_16_29_299 |   132|
|69    |                s19                                   |cf_rca_16_29_300 |   132|
|70    |              s18                                     |cf_rca_16_29_296 |   132|
|71    |              s19                                     |cf_rca_16_29_297 |   132|
|72    |            s18                                       |cf_rca_16_29_293 |   132|
|73    |            s19                                       |cf_rca_16_29_294 |   132|
|74    |          s22                                         |cf_rca_16_29_3   |   132|
|75    |          s23                                         |cf_rca_16_5      | 27513|
|76    |            s21                                       |cf_rca_16_22_4   |  1980|
|77    |              s17                                     |cf_rca_16_23_271 |  1716|
|78    |                s17                                   |cf_rca_16_24_274 |  1452|
|79    |                  s17                                 |cf_rca_16_25_277 |  1188|
|80    |                    s17                               |cf_rca_16_26_280 |   924|
|81    |                      s17                             |cf_rca_16_27_283 |   660|
|82    |                        s17                           |cf_rca_16_28_286 |   396|
|83    |                          s20                         |cf_rca_16_30_289 |   132|
|84    |                          s21                         |cf_rca_16_29_290 |   132|
|85    |                          s22                         |cf_rca_16_29_291 |   132|
|86    |                        s18                           |cf_rca_16_29_287 |   132|
|87    |                        s19                           |cf_rca_16_29_288 |   132|
|88    |                      s18                             |cf_rca_16_29_284 |   132|
|89    |                      s19                             |cf_rca_16_29_285 |   132|
|90    |                    s18                               |cf_rca_16_29_281 |   132|
|91    |                    s19                               |cf_rca_16_29_282 |   132|
|92    |                  s18                                 |cf_rca_16_29_278 |   132|
|93    |                  s19                                 |cf_rca_16_29_279 |   132|
|94    |                s18                                   |cf_rca_16_29_275 |   132|
|95    |                s19                                   |cf_rca_16_29_276 |   132|
|96    |              s18                                     |cf_rca_16_29_272 |   132|
|97    |              s19                                     |cf_rca_16_29_273 |   132|
|98    |            s22                                       |cf_rca_16_29_5   |   132|
|99    |            s23                                       |cf_rca_16_6      | 25401|
|100   |              s21                                     |cf_rca_16_22_6   |  1980|
|101   |                s17                                   |cf_rca_16_23_250 |  1716|
|102   |                  s17                                 |cf_rca_16_24_253 |  1452|
|103   |                    s17                               |cf_rca_16_25_256 |  1188|
|104   |                      s17                             |cf_rca_16_26_259 |   924|
|105   |                        s17                           |cf_rca_16_27_262 |   660|
|106   |                          s17                         |cf_rca_16_28_265 |   396|
|107   |                            s20                       |cf_rca_16_30_268 |   132|
|108   |                            s21                       |cf_rca_16_29_269 |   132|
|109   |                            s22                       |cf_rca_16_29_270 |   132|
|110   |                          s18                         |cf_rca_16_29_266 |   132|
|111   |                          s19                         |cf_rca_16_29_267 |   132|
|112   |                        s18                           |cf_rca_16_29_263 |   132|
|113   |                        s19                           |cf_rca_16_29_264 |   132|
|114   |                      s18                             |cf_rca_16_29_260 |   132|
|115   |                      s19                             |cf_rca_16_29_261 |   132|
|116   |                    s18                               |cf_rca_16_29_257 |   132|
|117   |                    s19                               |cf_rca_16_29_258 |   132|
|118   |                  s18                                 |cf_rca_16_29_254 |   132|
|119   |                  s19                                 |cf_rca_16_29_255 |   132|
|120   |                s18                                   |cf_rca_16_29_251 |   132|
|121   |                s19                                   |cf_rca_16_29_252 |   132|
|122   |              s22                                     |cf_rca_16_29_7   |   132|
|123   |              s23                                     |cf_rca_16_7      | 23289|
|124   |                s21                                   |cf_rca_16_22_8   |  1980|
|125   |                  s17                                 |cf_rca_16_23_229 |  1716|
|126   |                    s17                               |cf_rca_16_24_232 |  1452|
|127   |                      s17                             |cf_rca_16_25_235 |  1188|
|128   |                        s17                           |cf_rca_16_26_238 |   924|
|129   |                          s17                         |cf_rca_16_27_241 |   660|
|130   |                            s17                       |cf_rca_16_28_244 |   396|
|131   |                              s20                     |cf_rca_16_30_247 |   132|
|132   |                              s21                     |cf_rca_16_29_248 |   132|
|133   |                              s22                     |cf_rca_16_29_249 |   132|
|134   |                            s18                       |cf_rca_16_29_245 |   132|
|135   |                            s19                       |cf_rca_16_29_246 |   132|
|136   |                          s18                         |cf_rca_16_29_242 |   132|
|137   |                          s19                         |cf_rca_16_29_243 |   132|
|138   |                        s18                           |cf_rca_16_29_239 |   132|
|139   |                        s19                           |cf_rca_16_29_240 |   132|
|140   |                      s18                             |cf_rca_16_29_236 |   132|
|141   |                      s19                             |cf_rca_16_29_237 |   132|
|142   |                    s18                               |cf_rca_16_29_233 |   132|
|143   |                    s19                               |cf_rca_16_29_234 |   132|
|144   |                  s18                                 |cf_rca_16_29_230 |   132|
|145   |                  s19                                 |cf_rca_16_29_231 |   132|
|146   |                s22                                   |cf_rca_16_29_9   |   132|
|147   |                s23                                   |cf_rca_16_8      | 21177|
|148   |                  s21                                 |cf_rca_16_22_10  |  1980|
|149   |                    s17                               |cf_rca_16_23_208 |  1716|
|150   |                      s17                             |cf_rca_16_24_211 |  1452|
|151   |                        s17                           |cf_rca_16_25_214 |  1188|
|152   |                          s17                         |cf_rca_16_26_217 |   924|
|153   |                            s17                       |cf_rca_16_27_220 |   660|
|154   |                              s17                     |cf_rca_16_28_223 |   396|
|155   |                                s20                   |cf_rca_16_30_226 |   132|
|156   |                                s21                   |cf_rca_16_29_227 |   132|
|157   |                                s22                   |cf_rca_16_29_228 |   132|
|158   |                              s18                     |cf_rca_16_29_224 |   132|
|159   |                              s19                     |cf_rca_16_29_225 |   132|
|160   |                            s18                       |cf_rca_16_29_221 |   132|
|161   |                            s19                       |cf_rca_16_29_222 |   132|
|162   |                          s18                         |cf_rca_16_29_218 |   132|
|163   |                          s19                         |cf_rca_16_29_219 |   132|
|164   |                        s18                           |cf_rca_16_29_215 |   132|
|165   |                        s19                           |cf_rca_16_29_216 |   132|
|166   |                      s18                             |cf_rca_16_29_212 |   132|
|167   |                      s19                             |cf_rca_16_29_213 |   132|
|168   |                    s18                               |cf_rca_16_29_209 |   132|
|169   |                    s19                               |cf_rca_16_29_210 |   132|
|170   |                  s22                                 |cf_rca_16_29_11  |   132|
|171   |                  s23                                 |cf_rca_16_9      | 19065|
|172   |                    s19                               |cf_rca_16_22_12  |  1980|
|173   |                      s17                             |cf_rca_16_23_187 |  1716|
|174   |                        s17                           |cf_rca_16_24_190 |  1452|
|175   |                          s17                         |cf_rca_16_25_193 |  1188|
|176   |                            s17                       |cf_rca_16_26_196 |   924|
|177   |                              s17                     |cf_rca_16_27_199 |   660|
|178   |                                s17                   |cf_rca_16_28_202 |   396|
|179   |                                  s20                 |cf_rca_16_30_205 |   132|
|180   |                                  s21                 |cf_rca_16_29_206 |   132|
|181   |                                  s22                 |cf_rca_16_29_207 |   132|
|182   |                                s18                   |cf_rca_16_29_203 |   132|
|183   |                                s19                   |cf_rca_16_29_204 |   132|
|184   |                              s18                     |cf_rca_16_29_200 |   132|
|185   |                              s19                     |cf_rca_16_29_201 |   132|
|186   |                            s18                       |cf_rca_16_29_197 |   132|
|187   |                            s19                       |cf_rca_16_29_198 |   132|
|188   |                          s18                         |cf_rca_16_29_194 |   132|
|189   |                          s19                         |cf_rca_16_29_195 |   132|
|190   |                        s18                           |cf_rca_16_29_191 |   132|
|191   |                        s19                           |cf_rca_16_29_192 |   132|
|192   |                      s18                             |cf_rca_16_29_188 |   132|
|193   |                      s19                             |cf_rca_16_29_189 |   132|
|194   |                    s20                               |cf_rca_16_29_13  |   132|
|195   |                    s23                               |cf_rca_16_10     | 16953|
|196   |                      s19                             |cf_rca_16_22_14  |  1980|
|197   |                        s17                           |cf_rca_16_23_166 |  1716|
|198   |                          s17                         |cf_rca_16_24_169 |  1452|
|199   |                            s17                       |cf_rca_16_25_172 |  1188|
|200   |                              s17                     |cf_rca_16_26_175 |   924|
|201   |                                s17                   |cf_rca_16_27_178 |   660|
|202   |                                  s17                 |cf_rca_16_28_181 |   396|
|203   |                                    s20               |cf_rca_16_30_184 |   132|
|204   |                                    s21               |cf_rca_16_29_185 |   132|
|205   |                                    s22               |cf_rca_16_29_186 |   132|
|206   |                                  s18                 |cf_rca_16_29_182 |   132|
|207   |                                  s19                 |cf_rca_16_29_183 |   132|
|208   |                                s18                   |cf_rca_16_29_179 |   132|
|209   |                                s19                   |cf_rca_16_29_180 |   132|
|210   |                              s18                     |cf_rca_16_29_176 |   132|
|211   |                              s19                     |cf_rca_16_29_177 |   132|
|212   |                            s18                       |cf_rca_16_29_173 |   132|
|213   |                            s19                       |cf_rca_16_29_174 |   132|
|214   |                          s18                         |cf_rca_16_29_170 |   132|
|215   |                          s19                         |cf_rca_16_29_171 |   132|
|216   |                        s18                           |cf_rca_16_29_167 |   132|
|217   |                        s19                           |cf_rca_16_29_168 |   132|
|218   |                      s20                             |cf_rca_16_29_15  |    80|
|219   |                      s23                             |cf_rca_16_11     | 14683|
|220   |                        s19                           |cf_rca_16_29_16  |    80|
|221   |                        s20                           |cf_rca_16_18     |  1980|
|222   |                          s17                         |cf_rca_16_29_148 |   132|
|223   |                          s18                         |cf_rca_16_19     |  1716|
|224   |                            s17                       |cf_rca_16_29_150 |   132|
|225   |                            s18                       |cf_rca_16_20     |  1452|
|226   |                              s17                     |cf_rca_16_29_152 |   132|
|227   |                              s18                     |cf_rca_16_21     |  1188|
|228   |                                s17                   |cf_rca_16_29_154 |   132|
|229   |                                s18                   |cf_rca_16_26_155 |   924|
|230   |                                  s17                 |cf_rca_16_27_157 |   660|
|231   |                                    s17               |cf_rca_16_28_160 |   396|
|232   |                                      s20             |cf_rca_16_30_163 |   132|
|233   |                                      s21             |cf_rca_16_29_164 |   132|
|234   |                                      s22             |cf_rca_16_29_165 |   132|
|235   |                                    s18               |cf_rca_16_29_161 |   132|
|236   |                                    s19               |cf_rca_16_29_162 |   132|
|237   |                                  s18                 |cf_rca_16_29_158 |   132|
|238   |                                  s19                 |cf_rca_16_29_159 |   132|
|239   |                                s19                   |cf_rca_16_29_156 |   132|
|240   |                              s19                     |cf_rca_16_29_153 |   132|
|241   |                            s19                       |cf_rca_16_29_151 |   132|
|242   |                          s19                         |cf_rca_16_29_149 |   132|
|243   |                        s23                           |cf_rca_16_12     | 12623|
|244   |                          s21                         |cf_rca_16_22_17  |  1980|
|245   |                            s17                       |cf_rca_16_23_127 |  1716|
|246   |                              s17                     |cf_rca_16_24_130 |  1452|
|247   |                                s17                   |cf_rca_16_25_133 |  1188|
|248   |                                  s17                 |cf_rca_16_26_136 |   924|
|249   |                                    s17               |cf_rca_16_27_139 |   660|
|250   |                                      s17             |cf_rca_16_28_142 |   396|
|251   |                                        s20           |cf_rca_16_30_145 |   132|
|252   |                                        s21           |cf_rca_16_29_146 |   132|
|253   |                                        s22           |cf_rca_16_29_147 |   132|
|254   |                                      s18             |cf_rca_16_29_143 |   132|
|255   |                                      s19             |cf_rca_16_29_144 |   132|
|256   |                                    s18               |cf_rca_16_29_140 |   132|
|257   |                                    s19               |cf_rca_16_29_141 |   132|
|258   |                                  s18                 |cf_rca_16_29_137 |   132|
|259   |                                  s19                 |cf_rca_16_29_138 |   132|
|260   |                                s18                   |cf_rca_16_29_134 |   132|
|261   |                                s19                   |cf_rca_16_29_135 |   132|
|262   |                              s18                     |cf_rca_16_29_131 |   132|
|263   |                              s19                     |cf_rca_16_29_132 |   132|
|264   |                            s18                       |cf_rca_16_29_128 |   132|
|265   |                            s19                       |cf_rca_16_29_129 |   132|
|266   |                          s22                         |cf_rca_16_29_18  |    80|
|267   |                          s23                         |cf_rca_16_13     | 10563|
|268   |                            s21                       |cf_rca_16_22_19  |  1980|
|269   |                              s17                     |cf_rca_16_23_106 |  1716|
|270   |                                s17                   |cf_rca_16_24_109 |  1452|
|271   |                                  s17                 |cf_rca_16_25_112 |  1188|
|272   |                                    s17               |cf_rca_16_26_115 |   924|
|273   |                                      s17             |cf_rca_16_27_118 |   660|
|274   |                                        s17           |cf_rca_16_28_121 |   396|
|275   |                                          s20         |cf_rca_16_30_124 |   132|
|276   |                                          s21         |cf_rca_16_29_125 |   132|
|277   |                                          s22         |cf_rca_16_29_126 |   132|
|278   |                                        s18           |cf_rca_16_29_122 |   132|
|279   |                                        s19           |cf_rca_16_29_123 |   132|
|280   |                                      s18             |cf_rca_16_29_119 |   132|
|281   |                                      s19             |cf_rca_16_29_120 |   132|
|282   |                                    s18               |cf_rca_16_29_116 |   132|
|283   |                                    s19               |cf_rca_16_29_117 |   132|
|284   |                                  s18                 |cf_rca_16_29_113 |   132|
|285   |                                  s19                 |cf_rca_16_29_114 |   132|
|286   |                                s18                   |cf_rca_16_29_110 |   132|
|287   |                                s19                   |cf_rca_16_29_111 |   132|
|288   |                              s18                     |cf_rca_16_29_107 |   132|
|289   |                              s19                     |cf_rca_16_29_108 |   132|
|290   |                            s22                       |cf_rca_16_29_20  |   132|
|291   |                            s23                       |cf_rca_16_14     |  8451|
|292   |                              s21                     |cf_rca_16_22_21  |  1980|
|293   |                                s17                   |cf_rca_16_23_85  |  1716|
|294   |                                  s17                 |cf_rca_16_24_88  |  1452|
|295   |                                    s17               |cf_rca_16_25_91  |  1188|
|296   |                                      s17             |cf_rca_16_26_94  |   924|
|297   |                                        s17           |cf_rca_16_27_97  |   660|
|298   |                                          s17         |cf_rca_16_28_100 |   396|
|299   |                                            s20       |cf_rca_16_30_103 |   132|
|300   |                                            s21       |cf_rca_16_29_104 |   132|
|301   |                                            s22       |cf_rca_16_29_105 |   132|
|302   |                                          s18         |cf_rca_16_29_101 |   132|
|303   |                                          s19         |cf_rca_16_29_102 |   132|
|304   |                                        s18           |cf_rca_16_29_98  |   132|
|305   |                                        s19           |cf_rca_16_29_99  |   132|
|306   |                                      s18             |cf_rca_16_29_95  |   132|
|307   |                                      s19             |cf_rca_16_29_96  |   132|
|308   |                                    s18               |cf_rca_16_29_92  |   132|
|309   |                                    s19               |cf_rca_16_29_93  |   132|
|310   |                                  s18                 |cf_rca_16_29_89  |   132|
|311   |                                  s19                 |cf_rca_16_29_90  |   132|
|312   |                                s18                   |cf_rca_16_29_86  |   132|
|313   |                                s19                   |cf_rca_16_29_87  |   132|
|314   |                              s22                     |cf_rca_16_29_22  |   132|
|315   |                              s23                     |cf_rca_16_15     |  6339|
|316   |                                s21                   |cf_rca_16_22_23  |  1980|
|317   |                                  s17                 |cf_rca_16_23_64  |  1716|
|318   |                                    s17               |cf_rca_16_24_67  |  1452|
|319   |                                      s17             |cf_rca_16_25_70  |  1188|
|320   |                                        s17           |cf_rca_16_26_73  |   924|
|321   |                                          s17         |cf_rca_16_27_76  |   660|
|322   |                                            s17       |cf_rca_16_28_79  |   396|
|323   |                                              s20     |cf_rca_16_30_82  |   132|
|324   |                                              s21     |cf_rca_16_29_83  |   132|
|325   |                                              s22     |cf_rca_16_29_84  |   132|
|326   |                                            s18       |cf_rca_16_29_80  |   132|
|327   |                                            s19       |cf_rca_16_29_81  |   132|
|328   |                                          s18         |cf_rca_16_29_77  |   132|
|329   |                                          s19         |cf_rca_16_29_78  |   132|
|330   |                                        s18           |cf_rca_16_29_74  |   132|
|331   |                                        s19           |cf_rca_16_29_75  |   132|
|332   |                                      s18             |cf_rca_16_29_71  |   132|
|333   |                                      s19             |cf_rca_16_29_72  |   132|
|334   |                                    s18               |cf_rca_16_29_68  |   132|
|335   |                                    s19               |cf_rca_16_29_69  |   132|
|336   |                                  s18                 |cf_rca_16_29_65  |   132|
|337   |                                  s19                 |cf_rca_16_29_66  |   132|
|338   |                                s22                   |cf_rca_16_29_24  |   132|
|339   |                                s23                   |cf_rca_16_16     |  4227|
|340   |                                  s21                 |cf_rca_16_22_25  |  1982|
|341   |                                    s17               |cf_rca_16_23_43  |  1718|
|342   |                                      s17             |cf_rca_16_24_46  |  1454|
|343   |                                        s17           |cf_rca_16_25_49  |  1190|
|344   |                                          s17         |cf_rca_16_26_52  |   926|
|345   |                                            s17       |cf_rca_16_27_55  |   660|
|346   |                                              s17     |cf_rca_16_28_58  |   396|
|347   |                                                s20   |cf_rca_16_30_61  |   132|
|348   |                                                s21   |cf_rca_16_29_62  |   132|
|349   |                                                s22   |cf_rca_16_29_63  |   132|
|350   |                                              s18     |cf_rca_16_29_59  |   132|
|351   |                                              s19     |cf_rca_16_29_60  |   132|
|352   |                                            s18       |cf_rca_16_29_56  |   133|
|353   |                                            s19       |cf_rca_16_29_57  |   133|
|354   |                                          s18         |cf_rca_16_29_53  |   132|
|355   |                                          s19         |cf_rca_16_29_54  |   132|
|356   |                                        s18           |cf_rca_16_29_50  |   132|
|357   |                                        s19           |cf_rca_16_29_51  |   132|
|358   |                                      s18             |cf_rca_16_29_47  |   132|
|359   |                                      s19             |cf_rca_16_29_48  |   132|
|360   |                                    s18               |cf_rca_16_29_44  |   132|
|361   |                                    s19               |cf_rca_16_29_45  |   132|
|362   |                                  s22                 |cf_rca_16_29_26  |   132|
|363   |                                  s23                 |cf_rca_16_17     |  2113|
|364   |                                    s16               |cf_rca_16_22_27  |  1981|
|365   |                                      s17             |cf_rca_16_23     |  1717|
|366   |                                        s17           |cf_rca_16_24     |  1453|
|367   |                                          s17         |cf_rca_16_25     |  1189|
|368   |                                            s17       |cf_rca_16_26     |   924|
|369   |                                              s17     |cf_rca_16_27     |   660|
|370   |                                                s17   |cf_rca_16_28     |   396|
|371   |                                                  s20 |cf_rca_16_30     |   132|
|372   |                                                  s21 |cf_rca_16_29_41  |   132|
|373   |                                                  s22 |cf_rca_16_29_42  |   132|
|374   |                                                s18   |cf_rca_16_29_39  |   132|
|375   |                                                s19   |cf_rca_16_29_40  |   132|
|376   |                                              s18     |cf_rca_16_29_37  |   132|
|377   |                                              s19     |cf_rca_16_29_38  |   132|
|378   |                                            s18       |cf_rca_16_29_35  |   133|
|379   |                                            s19       |cf_rca_16_29_36  |   132|
|380   |                                          s18         |cf_rca_16_29_33  |   132|
|381   |                                          s19         |cf_rca_16_29_34  |   132|
|382   |                                        s18           |cf_rca_16_29_31  |   132|
|383   |                                        s19           |cf_rca_16_29_32  |   132|
|384   |                                      s18             |cf_rca_16_29_29  |   132|
|385   |                                      s19             |cf_rca_16_29_30  |   132|
|386   |                                    s17               |cf_rca_16_29_28  |   132|
|387   |    s9                                                |cf_rca_16_32     |  1104|
+------+------------------------------------------------------+-----------------+------+
---------------------------------------------------------------------------------
Finished Writing Synthesis Report : Time (s): cpu = 00:07:44 ; elapsed = 00:10:03 . Memory (MB): peak = 3113.582 ; gain = 261.090 ; free physical = 57810 ; free virtual = 385181
---------------------------------------------------------------------------------
Synthesis finished with 0 errors, 0 critical warnings and 1 warnings.
Synthesis Optimization Runtime : Time (s): cpu = 00:07:44 ; elapsed = 00:10:03 . Memory (MB): peak = 3113.582 ; gain = 261.090 ; free physical = 57837 ; free virtual = 385209
Synthesis Optimization Complete : Time (s): cpu = 00:07:44 ; elapsed = 00:10:03 . Memory (MB): peak = 3113.586 ; gain = 261.090 ; free physical = 57837 ; free virtual = 385209
INFO: [Project 1-571] Translating synthesized netlist
Netlist sorting complete. Time (s): cpu = 00:00:00.62 ; elapsed = 00:00:00.70 . Memory (MB): peak = 3134.688 ; gain = 0.000 ; free physical = 57856 ; free virtual = 385237
INFO: [Netlist 29-17] Analyzing 4096 Unisim elements for replacement
INFO: [Netlist 29-28] Unisim Transformation completed in 0 CPU seconds
INFO: [Project 1-570] Preparing netlist for logic optimization
INFO: [Opt 31-138] Pushed 0 inverter(s) to 0 load pin(s).
Netlist sorting complete. Time (s): cpu = 00:00:00.01 ; elapsed = 00:00:00.01 . Memory (MB): peak = 3134.688 ; gain = 0.000 ; free physical = 58747 ; free virtual = 386084
INFO: [Project 1-111] Unisim Transformation Summary:
No Unisim elements were transformed.

Synth Design complete, checksum: 514b0394
INFO: [Common 17-83] Releasing license: Synthesis
95 Infos, 1 Warnings, 0 Critical Warnings and 0 Errors encountered.
synth_design completed successfully
synth_design: Time (s): cpu = 00:10:06 ; elapsed = 00:12:21 . Memory (MB): peak = 3134.688 ; gain = 282.344 ; free physical = 59077 ; free virtual = 386415
INFO: [Common 17-600] The following parameters have non-default value.
general.maxThreads
# report_utilization -file /home/users/aram/Workspace/yosys_verific_rs/result_10-06-2022T20-03-24/Golden_vivado_diff.json/cf_rca_16/util_temp_top_vivado_synth.log
# report_timing_summary -file /home/users/aram/Workspace/yosys_verific_rs/result_10-06-2022T20-03-24/Golden_vivado_diff.json/cf_rca_16/timing_temp_top_vivado_synth.log -delay_type min_max -report_unconstrained -check_timing_verbose -max_paths 10000 -input_pins -routable_nets
INFO: [Timing 38-35] Done setting XDC timing constraints.
INFO: [Timing 38-91] UpdateTimingParams: Speed grade: -1, Delay Type: min_max.
report_timing_summary: Time (s): cpu = 00:00:24 ; elapsed = 00:00:26 . Memory (MB): peak = 3176.898 ; gain = 42.211 ; free physical = 61678 ; free virtual = 389021
# report_power -file /home/users/aram/Workspace/yosys_verific_rs/result_10-06-2022T20-03-24/Golden_vivado_diff.json/cf_rca_16/power_temp_top_vivado_synth.log
Command: report_power -file /home/users/aram/Workspace/yosys_verific_rs/result_10-06-2022T20-03-24/Golden_vivado_diff.json/cf_rca_16/power_temp_top_vivado_synth.log
WARNING: [Power 33-232] No user defined clocks were found in the design! Power estimation will be inaccurate until this is corrected.
Resolution: Please specify clocks using create_clock/create_generated_clock for sequential elements. For pure combinatorial circuits, please specify a virtual clock, otherwise the vectorless estimation might be inaccurate
Running Vector-less Activity Propagation...

Finished Running Vector-less Activity Propagation
0 Infos, 1 Warnings, 0 Critical Warnings and 0 Errors encountered.
report_power completed successfully
report_power: Time (s): cpu = 00:00:09 ; elapsed = 00:00:08 . Memory (MB): peak = 3280.195 ; gain = 103.297 ; free physical = 61471 ; free virtual = 388816
INFO: [Common 17-206] Exiting Vivado at Fri Jun 10 20:16:52 2022...
real 808.71
user 671.34
sys 145.25
