
 /----------------------------------------------------------------------------\
 |                                                                            |
 |  yosys -- Yosys Open SYnthesis Suite                                       |
 |                                                                            |
 |  Copyright (C) 2012 - 2020  Claire Xenia Wolf <claire@yosyshq.com>         |
 |                                                                            |
 |  Permission to use, copy, modify, and/or distribute this software for any  |
 |  purpose with or without fee is hereby granted, provided that the above    |
 |  copyright notice and this permission notice appear in all copies.         |
 |                                                                            |
 |  THE SOFTWARE IS PROVIDED "AS IS" AND THE AUTHOR DISCLAIMS ALL WARRANTIES  |
 |  WITH REGARD TO THIS SOFTWARE INCLUDING ALL IMPLIED WARRANTIES OF          |
 |  MERCHANTABILITY AND FITNESS. IN NO EVENT SHALL THE AUTHOR BE LIABLE FOR   |
 |  ANY SPECIAL, DIRECT, INDIRECT, OR CONSEQUENTIAL DAMAGES OR ANY DAMAGES    |
 |  WHATSOEVER RESULTING FROM LOSS OF USE, DATA OR PROFITS, WHETHER IN AN     |
 |  ACTION OF CONTRACT, NEGLIGENCE OR OTHER TORTIOUS ACTION, ARISING OUT OF   |
 |  OR IN CONNECTION WITH THE USE OR PERFORMANCE OF THIS SOFTWARE.            |
 |                                                                            |
 \----------------------------------------------------------------------------/

 Yosys-Verific 0.0.53
 Yosys 0.18+10 (git sha1 a3cbfccc4, gcc 9.4.0-1ubuntu1~20.04.1 -fPIC -Os)


-- Executing script file `yosys.ys' --
echo on

yosys> plugin -i synth-rs

yosys> read -verific

yosys> read -incdir .

yosys> verific -vlog-incdir .

1. Executing VERIFIC (loading SystemVerilog and VHDL designs using Verific).
Built with Verific May22_SW_Release, released at Wed Jun  1 00:39:28 2022.

yosys> verilog_defaults -add -I.

yosys> read -vlog2k gost89_round.v gost89_sbox.v gost89_ecb_encrypt.v gost89_cfb.v

yosys> verific -vlog2k gost89_round.v gost89_sbox.v gost89_ecb_encrypt.v gost89_cfb.v

2. Executing VERIFIC (loading SystemVerilog and VHDL designs using Verific).
Built with Verific May22_SW_Release, released at Wed Jun  1 00:39:28 2022.
VERIFIC-COMMENT [VERI-1482] Analyzing Verilog file 'gost89_round.v'
VERIFIC-COMMENT [VERI-1482] Analyzing Verilog file 'gost89_sbox.v'
VERIFIC-COMMENT [VERI-1482] Analyzing Verilog file 'gost89_ecb_encrypt.v'
VERIFIC-COMMENT [VERI-1482] Analyzing Verilog file 'gost89_cfb.v'

yosys> synth_rs -top gost89_cfb -tech genesis -goal area -de -no_dsp -no_bram -verilog synthesized.v

3. Executing synth_rs pass: v0.4.61

yosys> read_verilog -lib -specify -nomem2reg +/rapidsilicon/common/cells_sim.v +/rapidsilicon/genesis/cells_sim.v

3.1. Executing Verilog-2005 frontend: /nfs_scratch/scratch/Vorak/aram/Workspace/yosys_verific_rs/yosys/install/bin/../share/yosys/rapidsilicon/common/cells_sim.v
Parsing Verilog input from `/nfs_scratch/scratch/Vorak/aram/Workspace/yosys_verific_rs/yosys/install/bin/../share/yosys/rapidsilicon/common/cells_sim.v' to AST representation.
Generating RTLIL representation for module `\inv'.
Generating RTLIL representation for module `\buff'.
Generating RTLIL representation for module `\logic_0'.
Generating RTLIL representation for module `\logic_1'.
Generating RTLIL representation for module `\gclkbuff'.
Successfully finished Verilog frontend.

3.2. Executing Verilog-2005 frontend: /nfs_scratch/scratch/Vorak/aram/Workspace/yosys_verific_rs/yosys/install/bin/../share/yosys/rapidsilicon/genesis/cells_sim.v
Parsing Verilog input from `/nfs_scratch/scratch/Vorak/aram/Workspace/yosys_verific_rs/yosys/install/bin/../share/yosys/rapidsilicon/genesis/cells_sim.v' to AST representation.
Generating RTLIL representation for module `\dffsre'.
Generating RTLIL representation for module `\dffnsre'.
Generating RTLIL representation for module `\latchsre'.
Generating RTLIL representation for module `\latchnsre'.
Generating RTLIL representation for module `\io_scff'.
Generating RTLIL representation for module `\scff'.
Generating RTLIL representation for module `\sh_dff'.
Generating RTLIL representation for module `\adder_carry'.
Generating RTLIL representation for module `\sdffr'.
Generating RTLIL representation for module `\sdffs'.
Generating RTLIL representation for module `\TDP_BRAM18'.
Generating RTLIL representation for module `\TDP36K'.
Generating RTLIL representation for module `\RS_DSP1'.
Generating RTLIL representation for module `\RS_DSP2'.
Generating RTLIL representation for module `\RS_DSP2_MULT'.
Generating RTLIL representation for module `\RS_DSP2_MULT_REGIN'.
Generating RTLIL representation for module `\RS_DSP2_MULT_REGOUT'.
Generating RTLIL representation for module `\RS_DSP2_MULT_REGIN_REGOUT'.
Generating RTLIL representation for module `\RS_DSP2_MULTADD'.
Generating RTLIL representation for module `\RS_DSP2_MULTADD_REGIN'.
Generating RTLIL representation for module `\RS_DSP2_MULTADD_REGOUT'.
Generating RTLIL representation for module `\RS_DSP2_MULTADD_REGIN_REGOUT'.
Generating RTLIL representation for module `\RS_DSP2_MULTACC'.
Generating RTLIL representation for module `\RS_DSP2_MULTACC_REGIN'.
Generating RTLIL representation for module `\RS_DSP2_MULTACC_REGOUT'.
Generating RTLIL representation for module `\RS_DSP2_MULTACC_REGIN_REGOUT'.
Generating RTLIL representation for module `\dsp_t1_sim'.
Generating RTLIL representation for module `\dsp_t1_20x18x64'.
Generating RTLIL representation for module `\dsp_t1_10x9x32'.
Successfully finished Verilog frontend.

yosys> hierarchy -check -top gost89_cfb

3.3. Executing HIERARCHY pass (managing design hierarchy).
VERIFIC-INFO [VERI-1018] gost89_cfb.v:1: compiling module 'gost89_cfb'
VERIFIC-INFO [VERI-1018] gost89_ecb_encrypt.v:1: compiling module 'gost89_ecb_encrypt'
VERIFIC-INFO [VERI-1018] gost89_round.v:1: compiling module 'gost89_round'
VERIFIC-INFO [VERI-1018] gost89_sbox.v:1: compiling module 'gost89_sbox'
VERIFIC-WARNING [VERI-1209] gost89_ecb_encrypt.v:33: expression size 7 truncated to fit in target size 6
Importing module gost89_cfb.
Importing module gost89_ecb_encrypt.
Importing module gost89_round.
Importing module gost89_sbox.

3.3.1. Analyzing design hierarchy..
Top module:  \gost89_cfb
Used module:     \gost89_ecb_encrypt
Used module:         \gost89_round
Used module:             \gost89_sbox

3.3.2. Analyzing design hierarchy..
Top module:  \gost89_cfb
Used module:     \gost89_ecb_encrypt
Used module:         \gost89_round
Used module:             \gost89_sbox
Removed 0 unused modules.

yosys> proc

3.4. Executing PROC pass (convert processes to netlists).

yosys> proc_clean

3.4.1. Executing PROC_CLEAN pass (remove empty switches from decision trees).
Cleaned up 0 empty switches.

yosys> proc_rmdead

3.4.2. Executing PROC_RMDEAD pass (remove dead branches from decision trees).
Removed a total of 0 dead cases.

yosys> proc_prune

3.4.3. Executing PROC_PRUNE pass (remove redundant assignments in processes).
Removed 0 redundant assignments.
Promoted 0 assignments to connections.

yosys> proc_init

3.4.4. Executing PROC_INIT pass (extract init attributes).

yosys> proc_arst

3.4.5. Executing PROC_ARST pass (detect async resets in processes).

yosys> proc_rom

3.4.6. Executing PROC_ROM pass (convert switches to ROMs).
Converted 0 switches.

yosys> proc_mux

3.4.7. Executing PROC_MUX pass (convert decision trees to multiplexers).

yosys> proc_dlatch

3.4.8. Executing PROC_DLATCH pass (convert process syncs to latches).

yosys> proc_dff

3.4.9. Executing PROC_DFF pass (convert process syncs to FFs).

yosys> proc_memwr

3.4.10. Executing PROC_MEMWR pass (convert process memory writes to cells).

yosys> proc_clean

3.4.11. Executing PROC_CLEAN pass (remove empty switches from decision trees).
Cleaned up 0 empty switches.

yosys> opt_expr -keepdc

3.4.12. Executing OPT_EXPR pass (perform const folding).
Optimizing module gost89_sbox.
Optimizing module gost89_round.
Optimizing module gost89_ecb_encrypt.
<suppressed ~3 debug messages>
Optimizing module gost89_cfb.

yosys> bmuxmap

3.5. Executing BMUXMAP pass.

yosys> demuxmap

3.6. Executing DEMUXMAP pass.

yosys> clean_zerowidth

yosys> flatten

3.7. Executing FLATTEN pass (flatten design).
Deleting now unused module gost89_ecb_encrypt.
Deleting now unused module gost89_round.
Deleting now unused module gost89_sbox.
<suppressed ~10 debug messages>

yosys> bmuxmap

3.8. Executing BMUXMAP pass.

yosys> demuxmap

3.9. Executing DEMUXMAP pass.

yosys> clean_zerowidth

yosys> tribuf -logic

3.10. Executing TRIBUF pass.

yosys> deminout

3.11. Executing DEMINOUT pass (demote inout ports to input or output).

yosys> opt_expr

3.12. Executing OPT_EXPR pass (perform const folding).
Optimizing module gost89_cfb.

yosys> opt_clean

3.13. Executing OPT_CLEAN pass (remove unused cells and wires).
Finding unused cells or wires in module \gost89_cfb..
Removed 0 unused cells and 2345 unused wires.
<suppressed ~28 debug messages>

yosys> check

3.14. Executing CHECK pass (checking for obvious problems).
Checking module gost89_cfb...
Found and reported 0 problems.

yosys> opt_expr

3.15. Executing OPT_EXPR pass (perform const folding).
Optimizing module gost89_cfb.
<suppressed ~3 debug messages>

yosys> opt_merge -nomux

3.16. Executing OPT_MERGE pass (detect identical cells).
Finding identical cells in module `\gost89_cfb'.
<suppressed ~3 debug messages>
Removed a total of 1 cells.

yosys> opt_muxtree

3.17. Executing OPT_MUXTREE pass (detect dead branches in mux trees).
Running muxtree optimizer on module \gost89_cfb..
  Creating internal representation of mux trees.
  Evaluating internal representation of mux trees.
  Analyzing evaluation results.
Removed 0 multiplexer ports.
<suppressed ~22 debug messages>

yosys> opt_reduce

3.18. Executing OPT_REDUCE pass (consolidate $*mux and $reduce_* inputs).
  Optimizing cells in module \gost89_cfb.
    New ctrl vector for $pmux cell $flatten\ecb_encrypt.$verific$select_114$gost89_ecb_encrypt.v:80$1814: { $auto$opt_reduce.cc:134:opt_pmux$2455 $auto$opt_reduce.cc:134:opt_pmux$2453 $auto$opt_reduce.cc:134:opt_pmux$2451 $auto$opt_reduce.cc:134:opt_pmux$2449 $auto$opt_reduce.cc:134:opt_pmux$2447 $auto$opt_reduce.cc:134:opt_pmux$2445 $auto$opt_reduce.cc:134:opt_pmux$2443 $auto$opt_reduce.cc:134:opt_pmux$2441 $flatten\ecb_encrypt.$verific$n1897$1007 }
  Optimizing cells in module \gost89_cfb.
Performed a total of 1 changes.

yosys> opt_merge

3.19. Executing OPT_MERGE pass (detect identical cells).
Finding identical cells in module `\gost89_cfb'.
Removed a total of 0 cells.

yosys> opt_share

3.20. Executing OPT_SHARE pass.

yosys> opt_dff -nosdff -nodffe

3.21. Executing OPT_DFF pass (perform DFF optimizations).
Removing never-active async load on $verific$out_reg$gost89_cfb.v:40$956 ($aldff) from module gost89_cfb.
Removing never-active async load on $verific$in_value_reg$gost89_cfb.v:40$955 ($aldff) from module gost89_cfb.
Removing never-active async load on $verific$gamma_reg$gost89_cfb.v:40$953 ($aldff) from module gost89_cfb.
Removing never-active async load on $flatten\ecb_encrypt.$verific$round_num_reg$gost89_ecb_encrypt.v:44$1777 ($aldff) from module gost89_cfb.
Removing never-active async load on $flatten\ecb_encrypt.$verific$round_key_reg$gost89_ecb_encrypt.v:80$1815 ($aldff) from module gost89_cfb.
Removing never-active async load on $flatten\ecb_encrypt.$verific$out_reg$gost89_ecb_encrypt.v:44$1778 ($aldff) from module gost89_cfb.
Removing never-active async load on $flatten\ecb_encrypt.$verific$n2_reg$gost89_ecb_encrypt.v:44$1775 ($aldff) from module gost89_cfb.
Removing never-active async load on $flatten\ecb_encrypt.$verific$n1_reg$gost89_ecb_encrypt.v:44$1774 ($aldff) from module gost89_cfb.

yosys> opt_clean

3.22. Executing OPT_CLEAN pass (remove unused cells and wires).
Finding unused cells or wires in module \gost89_cfb..
Removed 0 unused cells and 4 unused wires.
<suppressed ~1 debug messages>

yosys> opt_expr

3.23. Executing OPT_EXPR pass (perform const folding).
Optimizing module gost89_cfb.
<suppressed ~6 debug messages>

yosys> opt_muxtree

3.24. Executing OPT_MUXTREE pass (detect dead branches in mux trees).
Running muxtree optimizer on module \gost89_cfb..
  Creating internal representation of mux trees.
  Evaluating internal representation of mux trees.
  Analyzing evaluation results.
Removed 0 multiplexer ports.
<suppressed ~22 debug messages>

yosys> opt_reduce

3.25. Executing OPT_REDUCE pass (consolidate $*mux and $reduce_* inputs).
  Optimizing cells in module \gost89_cfb.
Performed a total of 0 changes.

yosys> opt_merge

3.26. Executing OPT_MERGE pass (detect identical cells).
Finding identical cells in module `\gost89_cfb'.
Removed a total of 0 cells.

yosys> opt_share

3.27. Executing OPT_SHARE pass.

yosys> opt_dff -nosdff -nodffe

3.28. Executing OPT_DFF pass (perform DFF optimizations).

yosys> opt_clean

3.29. Executing OPT_CLEAN pass (remove unused cells and wires).
Finding unused cells or wires in module \gost89_cfb..
Removed 1 unused cells and 2 unused wires.
<suppressed ~2 debug messages>

yosys> opt_expr

3.30. Executing OPT_EXPR pass (perform const folding).
Optimizing module gost89_cfb.

yosys> opt_muxtree

3.31. Executing OPT_MUXTREE pass (detect dead branches in mux trees).
Running muxtree optimizer on module \gost89_cfb..
  Creating internal representation of mux trees.
  Evaluating internal representation of mux trees.
  Analyzing evaluation results.
Removed 0 multiplexer ports.
<suppressed ~22 debug messages>

yosys> opt_reduce

3.32. Executing OPT_REDUCE pass (consolidate $*mux and $reduce_* inputs).
  Optimizing cells in module \gost89_cfb.
Performed a total of 0 changes.

yosys> opt_merge

3.33. Executing OPT_MERGE pass (detect identical cells).
Finding identical cells in module `\gost89_cfb'.
Removed a total of 0 cells.

yosys> opt_share

3.34. Executing OPT_SHARE pass.

yosys> opt_dff -nosdff -nodffe

3.35. Executing OPT_DFF pass (perform DFF optimizations).

yosys> opt_clean

3.36. Executing OPT_CLEAN pass (remove unused cells and wires).
Finding unused cells or wires in module \gost89_cfb..

yosys> opt_expr

3.37. Executing OPT_EXPR pass (perform const folding).
Optimizing module gost89_cfb.
MAX OPT ITERATION = 3

yosys> fsm -encoding binary

3.38. Executing FSM pass (extract and optimize FSM).

yosys> fsm_detect

3.38.1. Executing FSM_DETECT pass (finding FSMs in design).

yosys> fsm_extract

3.38.2. Executing FSM_EXTRACT pass (extracting FSM from design).

yosys> fsm_opt

3.38.3. Executing FSM_OPT pass (simple optimizations of FSMs).

yosys> opt_clean

3.38.4. Executing OPT_CLEAN pass (remove unused cells and wires).
Finding unused cells or wires in module \gost89_cfb..

yosys> fsm_opt

3.38.5. Executing FSM_OPT pass (simple optimizations of FSMs).

yosys> fsm_recode -encoding binary

3.38.6. Executing FSM_RECODE pass (re-assigning FSM state encoding).

yosys> fsm_info

3.38.7. Executing FSM_INFO pass (dumping all available information on FSM cells).

yosys> fsm_map

3.38.8. Executing FSM_MAP pass (mapping FSMs to basic logic).

yosys> opt_expr

3.39. Executing OPT_EXPR pass (perform const folding).
Optimizing module gost89_cfb.

yosys> opt_merge -nomux

3.40. Executing OPT_MERGE pass (detect identical cells).
Finding identical cells in module `\gost89_cfb'.
Removed a total of 0 cells.

yosys> opt_muxtree

3.41. Executing OPT_MUXTREE pass (detect dead branches in mux trees).
Running muxtree optimizer on module \gost89_cfb..
  Creating internal representation of mux trees.
  Evaluating internal representation of mux trees.
  Analyzing evaluation results.
Removed 0 multiplexer ports.
<suppressed ~22 debug messages>

yosys> opt_reduce

3.42. Executing OPT_REDUCE pass (consolidate $*mux and $reduce_* inputs).
  Optimizing cells in module \gost89_cfb.
Performed a total of 0 changes.

yosys> opt_merge

3.43. Executing OPT_MERGE pass (detect identical cells).
Finding identical cells in module `\gost89_cfb'.
Removed a total of 0 cells.

yosys> opt_share

3.44. Executing OPT_SHARE pass.

yosys> opt_dff -nosdff -sat

3.45. Executing OPT_DFF pass (perform DFF optimizations).
Adding EN signal on $verific$out_reg$gost89_cfb.v:40$956 ($dff) from module gost89_cfb (D = $verific$n413$21, Q = \out).
Adding EN signal on $verific$in_value_reg$gost89_cfb.v:40$955 ($dff) from module gost89_cfb (D = \in, Q = \in_value).
Adding EN signal on $verific$gamma_reg$gost89_cfb.v:40$953 ($dff) from module gost89_cfb (D = $verific$n739$25, Q = \gamma).
Adding EN signal on $verific$busy_reg$gost89_cfb.v:40$954 ($dff) from module gost89_cfb (D = $verific$n869$16, Q = \busy).
Adding EN signal on $flatten\ecb_encrypt.$verific$round_key_reg$gost89_ecb_encrypt.v:80$1815 ($dff) from module gost89_cfb (D = $flatten\ecb_encrypt.$verific$n1898$1062, Q = \ecb_encrypt.round_key).
Adding EN signal on $flatten\ecb_encrypt.$verific$out_reg$gost89_ecb_encrypt.v:44$1778 ($dff) from module gost89_cfb (D = { \ecb_encrypt.n1 \ecb_encrypt.out1 }, Q = \ecb_encrypt.out).

yosys> opt_clean

3.46. Executing OPT_CLEAN pass (remove unused cells and wires).
Finding unused cells or wires in module \gost89_cfb..
Removed 4 unused cells and 4 unused wires.
<suppressed ~5 debug messages>

yosys> opt_expr

3.47. Executing OPT_EXPR pass (perform const folding).
Optimizing module gost89_cfb.
<suppressed ~6 debug messages>
MAX OPT ITERATION = 1

yosys> wreduce -keepdc

3.48. Executing WREDUCE pass (reducing word size of cells).
Removed top 5 bits (of 6) from port A of cell gost89_cfb.$flatten\ecb_encrypt.$verific$LessThan_25$gost89_ecb_encrypt.v:34$1759 ($lt).
Removed top 5 bits (of 6) from port B of cell gost89_cfb.$flatten\ecb_encrypt.$verific$add_22$gost89_ecb_encrypt.v:33$1756 ($add).
Removed top 1 bits (of 6) from port B of cell gost89_cfb.$flatten\ecb_encrypt.$verific$equal_100$gost89_ecb_encrypt.v:67$1798 ($eq).
Removed top 1 bits (of 6) from port B of cell gost89_cfb.$flatten\ecb_encrypt.$verific$equal_101$gost89_ecb_encrypt.v:68$1799 ($eq).
Removed top 1 bits (of 6) from port B of cell gost89_cfb.$flatten\ecb_encrypt.$verific$equal_102$gost89_ecb_encrypt.v:69$1800 ($eq).
Removed top 1 bits (of 6) from port B of cell gost89_cfb.$flatten\ecb_encrypt.$verific$equal_103$gost89_ecb_encrypt.v:70$1801 ($eq).
Removed top 1 bits (of 6) from port B of cell gost89_cfb.$flatten\ecb_encrypt.$verific$equal_104$gost89_ecb_encrypt.v:71$1802 ($eq).
Removed top 1 bits (of 6) from port B of cell gost89_cfb.$flatten\ecb_encrypt.$verific$equal_105$gost89_ecb_encrypt.v:72$1803 ($eq).
Removed top 1 bits (of 6) from port B of cell gost89_cfb.$flatten\ecb_encrypt.$verific$equal_106$gost89_ecb_encrypt.v:73$1804 ($eq).
Removed top 1 bits (of 6) from port B of cell gost89_cfb.$flatten\ecb_encrypt.$verific$equal_107$gost89_ecb_encrypt.v:74$1805 ($eq).
Removed top 1 bits (of 6) from port B of cell gost89_cfb.$flatten\ecb_encrypt.$verific$equal_108$gost89_ecb_encrypt.v:75$1806 ($eq).
Removed top 1 bits (of 6) from port B of cell gost89_cfb.$flatten\ecb_encrypt.$verific$equal_109$gost89_ecb_encrypt.v:76$1807 ($eq).
Removed top 1 bits (of 6) from port B of cell gost89_cfb.$flatten\ecb_encrypt.$verific$equal_110$gost89_ecb_encrypt.v:77$1808 ($eq).
Removed top 1 bits (of 6) from port B of cell gost89_cfb.$flatten\ecb_encrypt.$verific$equal_111$gost89_ecb_encrypt.v:78$1809 ($eq).
Removed top 1 bits (of 6) from port B of cell gost89_cfb.$flatten\ecb_encrypt.$verific$equal_112$gost89_ecb_encrypt.v:79$1810 ($eq).
Removed top 5 bits (of 6) from port B of cell gost89_cfb.$flatten\ecb_encrypt.$verific$equal_82$gost89_ecb_encrypt.v:49$1780 ($eq).
Removed top 4 bits (of 6) from port B of cell gost89_cfb.$flatten\ecb_encrypt.$verific$equal_83$gost89_ecb_encrypt.v:50$1781 ($eq).
Removed top 4 bits (of 6) from port B of cell gost89_cfb.$flatten\ecb_encrypt.$verific$equal_84$gost89_ecb_encrypt.v:51$1782 ($eq).
Removed top 3 bits (of 6) from port B of cell gost89_cfb.$flatten\ecb_encrypt.$verific$equal_85$gost89_ecb_encrypt.v:52$1783 ($eq).
Removed top 3 bits (of 6) from port B of cell gost89_cfb.$flatten\ecb_encrypt.$verific$equal_86$gost89_ecb_encrypt.v:53$1784 ($eq).
Removed top 3 bits (of 6) from port B of cell gost89_cfb.$flatten\ecb_encrypt.$verific$equal_87$gost89_ecb_encrypt.v:54$1785 ($eq).
Removed top 3 bits (of 6) from port B of cell gost89_cfb.$flatten\ecb_encrypt.$verific$equal_88$gost89_ecb_encrypt.v:55$1786 ($eq).
Removed top 2 bits (of 6) from port B of cell gost89_cfb.$flatten\ecb_encrypt.$verific$equal_89$gost89_ecb_encrypt.v:56$1787 ($eq).
Removed top 2 bits (of 6) from port B of cell gost89_cfb.$flatten\ecb_encrypt.$verific$equal_90$gost89_ecb_encrypt.v:57$1788 ($eq).
Removed top 2 bits (of 6) from port B of cell gost89_cfb.$flatten\ecb_encrypt.$verific$equal_91$gost89_ecb_encrypt.v:58$1789 ($eq).
Removed top 2 bits (of 6) from port B of cell gost89_cfb.$flatten\ecb_encrypt.$verific$equal_92$gost89_ecb_encrypt.v:59$1790 ($eq).
Removed top 2 bits (of 6) from port B of cell gost89_cfb.$flatten\ecb_encrypt.$verific$equal_93$gost89_ecb_encrypt.v:60$1791 ($eq).
Removed top 2 bits (of 6) from port B of cell gost89_cfb.$flatten\ecb_encrypt.$verific$equal_94$gost89_ecb_encrypt.v:61$1792 ($eq).
Removed top 2 bits (of 6) from port B of cell gost89_cfb.$flatten\ecb_encrypt.$verific$equal_95$gost89_ecb_encrypt.v:62$1793 ($eq).
Removed top 2 bits (of 6) from port B of cell gost89_cfb.$flatten\ecb_encrypt.$verific$equal_96$gost89_ecb_encrypt.v:63$1794 ($eq).
Removed top 1 bits (of 6) from port B of cell gost89_cfb.$flatten\ecb_encrypt.$verific$equal_97$gost89_ecb_encrypt.v:64$1795 ($eq).
Removed top 1 bits (of 6) from port B of cell gost89_cfb.$flatten\ecb_encrypt.$verific$equal_98$gost89_ecb_encrypt.v:65$1796 ($eq).
Removed top 1 bits (of 6) from port B of cell gost89_cfb.$flatten\ecb_encrypt.$verific$equal_99$gost89_ecb_encrypt.v:66$1797 ($eq).

yosys> peepopt

3.49. Executing PEEPOPT pass (run peephole optimizers).

yosys> opt_clean

3.50. Executing OPT_CLEAN pass (remove unused cells and wires).
Finding unused cells or wires in module \gost89_cfb..
Removed 0 unused cells and 1 unused wires.
<suppressed ~1 debug messages>

yosys> bmuxmap

3.51. Executing BMUXMAP pass.

yosys> demuxmap

3.52. Executing DEMUXMAP pass.

yosys> clean_zerowidth

yosys> alumacc

3.53. Executing ALUMACC pass (create $alu and $macc cells).
Extracting $alu and $macc cells in module gost89_cfb:
  creating $macc model for $flatten\ecb_encrypt.$verific$add_22$gost89_ecb_encrypt.v:33$1756 ($add).
  creating $macc model for $flatten\ecb_encrypt.\rnd.$verific$add_3$gost89_round.v:12$1822 ($add).
  creating $alu model for $macc $flatten\ecb_encrypt.\rnd.$verific$add_3$gost89_round.v:12$1822.
  creating $alu model for $macc $flatten\ecb_encrypt.$verific$add_22$gost89_ecb_encrypt.v:33$1756.
  creating $alu model for $flatten\ecb_encrypt.$verific$LessThan_21$gost89_ecb_encrypt.v:32$1755 ($lt): new $alu
  creating $alu model for $flatten\ecb_encrypt.$verific$LessThan_25$gost89_ecb_encrypt.v:34$1759 ($lt): new $alu
  creating $alu model for $flatten\ecb_encrypt.$verific$equal_32$gost89_ecb_encrypt.v:38$1765 ($eq): merged with $flatten\ecb_encrypt.$verific$LessThan_21$gost89_ecb_encrypt.v:32$1755.
  creating $alu cell for $flatten\ecb_encrypt.$verific$LessThan_25$gost89_ecb_encrypt.v:34$1759: $auto$alumacc.cc:485:replace_alu$2474
  creating $alu cell for $flatten\ecb_encrypt.$verific$LessThan_21$gost89_ecb_encrypt.v:32$1755, $flatten\ecb_encrypt.$verific$equal_32$gost89_ecb_encrypt.v:38$1765: $auto$alumacc.cc:485:replace_alu$2479
  creating $alu cell for $flatten\ecb_encrypt.$verific$add_22$gost89_ecb_encrypt.v:33$1756: $auto$alumacc.cc:485:replace_alu$2490
  creating $alu cell for $flatten\ecb_encrypt.\rnd.$verific$add_3$gost89_round.v:12$1822: $auto$alumacc.cc:485:replace_alu$2493
  created 4 $alu and 0 $macc cells.

yosys> opt_expr

3.54. Executing OPT_EXPR pass (perform const folding).
Optimizing module gost89_cfb.
<suppressed ~1 debug messages>

yosys> opt_merge -nomux

3.55. Executing OPT_MERGE pass (detect identical cells).
Finding identical cells in module `\gost89_cfb'.
Removed a total of 0 cells.

yosys> opt_muxtree

3.56. Executing OPT_MUXTREE pass (detect dead branches in mux trees).
Running muxtree optimizer on module \gost89_cfb..
  Creating internal representation of mux trees.
  Evaluating internal representation of mux trees.
  Analyzing evaluation results.
Removed 0 multiplexer ports.
<suppressed ~19 debug messages>

yosys> opt_reduce

3.57. Executing OPT_REDUCE pass (consolidate $*mux and $reduce_* inputs).
  Optimizing cells in module \gost89_cfb.
    New input vector for $reduce_and cell $auto$opt_dff.cc:220:make_patterns_logic$2471: { $auto$alumacc.cc:501:replace_alu$2480 $auto$rtlil.cc:2369:Not$2469 }
  Optimizing cells in module \gost89_cfb.
Performed a total of 1 changes.

yosys> opt_merge

3.58. Executing OPT_MERGE pass (detect identical cells).
Finding identical cells in module `\gost89_cfb'.
Removed a total of 0 cells.

yosys> opt_share

3.59. Executing OPT_SHARE pass.

yosys> opt_dff -nosdff -nodffe

3.60. Executing OPT_DFF pass (perform DFF optimizations).

yosys> opt_clean

3.61. Executing OPT_CLEAN pass (remove unused cells and wires).
Finding unused cells or wires in module \gost89_cfb..
Removed 0 unused cells and 3 unused wires.
<suppressed ~1 debug messages>

yosys> opt_expr

3.62. Executing OPT_EXPR pass (perform const folding).
Optimizing module gost89_cfb.
MAX OPT ITERATION = 1

yosys> stat

3.63. Printing statistics.

=== gost89_cfb ===

   Number of wires:                176
   Number of wire bits:           4604
   Number of public wires:          62
   Number of public wire bits:    3475
   Number of memories:               0
   Number of memory bits:            0
   Number of processes:              0
   Number of cells:                215
     $alu                            4
     $and                            6
     $dff                            4
     $dffe                           6
     $eq                            31
     $logic_not                      1
     $mux                          138
     $not                            8
     $or                             1
     $pmux                           1
     $reduce_and                     2
     $reduce_bool                    2
     $reduce_or                      9
     $xor                            2


yosys> memory -nomap

3.64. Executing MEMORY pass.

yosys> opt_mem

3.64.1. Executing OPT_MEM pass (optimize memories).
Performed a total of 0 transformations.

yosys> opt_mem_priority

3.64.2. Executing OPT_MEM_PRIORITY pass (removing unnecessary memory write priority relations).
Performed a total of 0 transformations.

yosys> opt_mem_feedback

3.64.3. Executing OPT_MEM_FEEDBACK pass (finding memory read-to-write feedback paths).

yosys> memory_bmux2rom

3.64.4. Executing MEMORY_BMUX2ROM pass (converting muxes to ROMs).

yosys> memory_dff

3.64.5. Executing MEMORY_DFF pass (merging $dff cells to $memrd).

yosys> opt_clean

3.64.6. Executing OPT_CLEAN pass (remove unused cells and wires).
Finding unused cells or wires in module \gost89_cfb..

yosys> memory_share

3.64.7. Executing MEMORY_SHARE pass (consolidating $memrd/$memwr cells).

yosys> opt_mem_widen

3.64.8. Executing OPT_MEM_WIDEN pass (optimize memories where all ports are wide).
Performed a total of 0 transformations.

yosys> opt_clean

3.64.9. Executing OPT_CLEAN pass (remove unused cells and wires).
Finding unused cells or wires in module \gost89_cfb..

yosys> memory_collect

3.64.10. Executing MEMORY_COLLECT pass (generating $mem cells).

yosys> stat

3.65. Printing statistics.

=== gost89_cfb ===

   Number of wires:                176
   Number of wire bits:           4604
   Number of public wires:          62
   Number of public wire bits:    3475
   Number of memories:               0
   Number of memory bits:            0
   Number of processes:              0
   Number of cells:                215
     $alu                            4
     $and                            6
     $dff                            4
     $dffe                           6
     $eq                            31
     $logic_not                      1
     $mux                          138
     $not                            8
     $or                             1
     $pmux                           1
     $reduce_and                     2
     $reduce_bool                    2
     $reduce_or                      9
     $xor                            2


yosys> muxpack

3.66. Executing MUXPACK pass ($mux cell cascades to $pmux).
Converted 0 (p)mux cells into 0 pmux cells.
<suppressed ~139 debug messages>

yosys> opt_clean

3.67. Executing OPT_CLEAN pass (remove unused cells and wires).
Finding unused cells or wires in module \gost89_cfb..

yosys> pmuxtree

3.68. Executing PMUXTREE pass.

yosys> muxpack

3.69. Executing MUXPACK pass ($mux cell cascades to $pmux).
Converting gost89_cfb.$auto$pmuxtree.cc:65:recursive_mux_generator$2512 ... gost89_cfb.$auto$pmuxtree.cc:65:recursive_mux_generator$2514 to a pmux with 2 cases.
Converting gost89_cfb.$auto$pmuxtree.cc:65:recursive_mux_generator$2502 ... gost89_cfb.$auto$pmuxtree.cc:65:recursive_mux_generator$2504 to a pmux with 2 cases.
Converted 4 (p)mux cells into 2 pmux cells.
<suppressed ~147 debug messages>

yosys> memory_map

3.70. Executing MEMORY_MAP pass (converting memories to logic and flip-flops).

yosys> stat

3.71. Printing statistics.

=== gost89_cfb ===

   Number of wires:                190
   Number of wire bits:           4897
   Number of public wires:          62
   Number of public wire bits:    3475
   Number of memories:               0
   Number of memory bits:            0
   Number of processes:              0
   Number of cells:                226
     $alu                            4
     $and                            6
     $dff                            4
     $dffe                           6
     $eq                            31
     $logic_not                      1
     $mux                          143
     $not                            9
     $or                             3
     $pmux                           2
     $reduce_and                     2
     $reduce_bool                    2
     $reduce_or                     11
     $xor                            2


yosys> techmap -map +/techmap.v -map +/rapidsilicon/genesis/arith_map.v

3.72. Executing TECHMAP pass (map to technology primitives).

3.72.1. Executing Verilog-2005 frontend: /nfs_scratch/scratch/Vorak/aram/Workspace/yosys_verific_rs/yosys/install/bin/../share/yosys/techmap.v
Parsing Verilog input from `/nfs_scratch/scratch/Vorak/aram/Workspace/yosys_verific_rs/yosys/install/bin/../share/yosys/techmap.v' to AST representation.
Generating RTLIL representation for module `\_90_simplemap_bool_ops'.
Generating RTLIL representation for module `\_90_simplemap_reduce_ops'.
Generating RTLIL representation for module `\_90_simplemap_logic_ops'.
Generating RTLIL representation for module `\_90_simplemap_compare_ops'.
Generating RTLIL representation for module `\_90_simplemap_various'.
Generating RTLIL representation for module `\_90_simplemap_registers'.
Generating RTLIL representation for module `\_90_shift_ops_shr_shl_sshl_sshr'.
Generating RTLIL representation for module `\_90_shift_shiftx'.
Generating RTLIL representation for module `\_90_fa'.
Generating RTLIL representation for module `\_90_lcu'.
Generating RTLIL representation for module `\_90_alu'.
Generating RTLIL representation for module `\_90_macc'.
Generating RTLIL representation for module `\_90_alumacc'.
Generating RTLIL representation for module `\$__div_mod_u'.
Generating RTLIL representation for module `\$__div_mod_trunc'.
Generating RTLIL representation for module `\_90_div'.
Generating RTLIL representation for module `\_90_mod'.
Generating RTLIL representation for module `\$__div_mod_floor'.
Generating RTLIL representation for module `\_90_divfloor'.
Generating RTLIL representation for module `\_90_modfloor'.
Generating RTLIL representation for module `\_90_pow'.
Generating RTLIL representation for module `\_90_pmux'.
Generating RTLIL representation for module `\_90_demux'.
Generating RTLIL representation for module `\_90_lut'.
Successfully finished Verilog frontend.

3.72.2. Executing Verilog-2005 frontend: /nfs_scratch/scratch/Vorak/aram/Workspace/yosys_verific_rs/yosys/install/bin/../share/yosys/rapidsilicon/genesis/arith_map.v
Parsing Verilog input from `/nfs_scratch/scratch/Vorak/aram/Workspace/yosys_verific_rs/yosys/install/bin/../share/yosys/rapidsilicon/genesis/arith_map.v' to AST representation.
Generating RTLIL representation for module `\_80_rs_alu'.
Successfully finished Verilog frontend.

3.72.3. Continuing TECHMAP pass.
Using extmapper simplemap for cells of type $not.
Using extmapper simplemap for cells of type $and.
Using extmapper simplemap for cells of type $mux.
Using extmapper simplemap for cells of type $xor.
Using extmapper simplemap for cells of type $dffe.
Using extmapper simplemap for cells of type $reduce_or.
Using extmapper simplemap for cells of type $reduce_and.
Using extmapper simplemap for cells of type $or.
Using template $paramod$8fabc56b80a569262acfc42757a02ca0b8e91278\_90_pmux for cells of type $pmux.
Using extmapper simplemap for cells of type $reduce_bool.
Using template $paramod$32efbfac1c4dc57230cf86180788fdfd12e3b511\_90_alu for cells of type $alu.
Using template $paramod$00298f3f8094950cb9a5ff2fda48d0d8bde8806c\_90_alu for cells of type $alu.
Using template $paramod$be80489e44a49c29884f59fd81c31ed03229cfc1\_80_rs_alu for cells of type $alu.
Using extmapper simplemap for cells of type $dff.
Using extmapper simplemap for cells of type $eq.
Using extmapper simplemap for cells of type $logic_not.
Using template $paramod\_90_lcu\WIDTH=32'00000000000000000000000000000110 for cells of type $lcu.
Using extmapper simplemap for cells of type $pos.
No more expansions possible.
<suppressed ~805 debug messages>

yosys> stat

3.73. Printing statistics.

=== gost89_cfb ===

   Number of wires:                731
   Number of wire bits:          10359
   Number of public wires:          62
   Number of public wire bits:    3475
   Number of memories:               0
   Number of memory bits:            0
   Number of processes:              0
   Number of cells:               2517
     $_AND_                        193
     $_DFFE_PP_                    289
     $_DFF_P_                       71
     $_MUX_                       1164
     $_NOT_                         91
     $_OR_                         322
     $_XOR_                        355
     adder_carry                    32


yosys> opt_expr

3.74. Executing OPT_EXPR pass (perform const folding).
Optimizing module gost89_cfb.
<suppressed ~345 debug messages>

yosys> opt_merge -nomux

3.75. Executing OPT_MERGE pass (detect identical cells).
Finding identical cells in module `\gost89_cfb'.
<suppressed ~636 debug messages>
Removed a total of 212 cells.

yosys> opt_muxtree

3.76. Executing OPT_MUXTREE pass (detect dead branches in mux trees).
Running muxtree optimizer on module \gost89_cfb..
  Creating internal representation of mux trees.
  No muxes found in this module.
Removed 0 multiplexer ports.

yosys> opt_reduce

3.77. Executing OPT_REDUCE pass (consolidate $*mux and $reduce_* inputs).
  Optimizing cells in module \gost89_cfb.
Performed a total of 0 changes.

yosys> opt_merge

3.78. Executing OPT_MERGE pass (detect identical cells).
Finding identical cells in module `\gost89_cfb'.
Removed a total of 0 cells.

yosys> opt_share

3.79. Executing OPT_SHARE pass.

yosys> opt_dff -nosdff -nodffe

3.80. Executing OPT_DFF pass (perform DFF optimizations).

yosys> opt_clean

3.81. Executing OPT_CLEAN pass (remove unused cells and wires).
Finding unused cells or wires in module \gost89_cfb..
Removed 50 unused cells and 556 unused wires.
<suppressed ~51 debug messages>

yosys> opt_expr

3.82. Executing OPT_EXPR pass (perform const folding).
Optimizing module gost89_cfb.

yosys> opt_muxtree

3.83. Executing OPT_MUXTREE pass (detect dead branches in mux trees).
Running muxtree optimizer on module \gost89_cfb..
  Creating internal representation of mux trees.
  No muxes found in this module.
Removed 0 multiplexer ports.

yosys> opt_reduce

3.84. Executing OPT_REDUCE pass (consolidate $*mux and $reduce_* inputs).
  Optimizing cells in module \gost89_cfb.
Performed a total of 0 changes.

yosys> opt_merge

3.85. Executing OPT_MERGE pass (detect identical cells).
Finding identical cells in module `\gost89_cfb'.
Removed a total of 0 cells.

yosys> opt_share

3.86. Executing OPT_SHARE pass.

yosys> opt_dff -nosdff -nodffe

3.87. Executing OPT_DFF pass (perform DFF optimizations).

yosys> opt_clean

3.88. Executing OPT_CLEAN pass (remove unused cells and wires).
Finding unused cells or wires in module \gost89_cfb..

yosys> opt_expr

3.89. Executing OPT_EXPR pass (perform const folding).
Optimizing module gost89_cfb.
MAX OPT ITERATION = 2

yosys> opt_expr -full

3.90. Executing OPT_EXPR pass (perform const folding).
Optimizing module gost89_cfb.
<suppressed ~131 debug messages>

yosys> techmap -map +/techmap.v

3.91. Executing TECHMAP pass (map to technology primitives).

3.91.1. Executing Verilog-2005 frontend: /nfs_scratch/scratch/Vorak/aram/Workspace/yosys_verific_rs/yosys/install/bin/../share/yosys/techmap.v
Parsing Verilog input from `/nfs_scratch/scratch/Vorak/aram/Workspace/yosys_verific_rs/yosys/install/bin/../share/yosys/techmap.v' to AST representation.
Generating RTLIL representation for module `\_90_simplemap_bool_ops'.
Generating RTLIL representation for module `\_90_simplemap_reduce_ops'.
Generating RTLIL representation for module `\_90_simplemap_logic_ops'.
Generating RTLIL representation for module `\_90_simplemap_compare_ops'.
Generating RTLIL representation for module `\_90_simplemap_various'.
Generating RTLIL representation for module `\_90_simplemap_registers'.
Generating RTLIL representation for module `\_90_shift_ops_shr_shl_sshl_sshr'.
Generating RTLIL representation for module `\_90_shift_shiftx'.
Generating RTLIL representation for module `\_90_fa'.
Generating RTLIL representation for module `\_90_lcu'.
Generating RTLIL representation for module `\_90_alu'.
Generating RTLIL representation for module `\_90_macc'.
Generating RTLIL representation for module `\_90_alumacc'.
Generating RTLIL representation for module `\$__div_mod_u'.
Generating RTLIL representation for module `\$__div_mod_trunc'.
Generating RTLIL representation for module `\_90_div'.
Generating RTLIL representation for module `\_90_mod'.
Generating RTLIL representation for module `\$__div_mod_floor'.
Generating RTLIL representation for module `\_90_divfloor'.
Generating RTLIL representation for module `\_90_modfloor'.
Generating RTLIL representation for module `\_90_pow'.
Generating RTLIL representation for module `\_90_pmux'.
Generating RTLIL representation for module `\_90_demux'.
Generating RTLIL representation for module `\_90_lut'.
Successfully finished Verilog frontend.

3.91.2. Continuing TECHMAP pass.
No more expansions possible.
<suppressed ~71 debug messages>

yosys> opt_expr

3.92. Executing OPT_EXPR pass (perform const folding).
Optimizing module gost89_cfb.

yosys> opt_merge -nomux

3.93. Executing OPT_MERGE pass (detect identical cells).
Finding identical cells in module `\gost89_cfb'.
Removed a total of 0 cells.

yosys> opt_muxtree

3.94. Executing OPT_MUXTREE pass (detect dead branches in mux trees).
Running muxtree optimizer on module \gost89_cfb..
  Creating internal representation of mux trees.
  No muxes found in this module.
Removed 0 multiplexer ports.

yosys> opt_reduce

3.95. Executing OPT_REDUCE pass (consolidate $*mux and $reduce_* inputs).
  Optimizing cells in module \gost89_cfb.
Performed a total of 0 changes.

yosys> opt_merge

3.96. Executing OPT_MERGE pass (detect identical cells).
Finding identical cells in module `\gost89_cfb'.
Removed a total of 0 cells.

yosys> opt_dff -nosdff -nodffe -sat

3.97. Executing OPT_DFF pass (perform DFF optimizations).

yosys> opt_clean

3.98. Executing OPT_CLEAN pass (remove unused cells and wires).
Finding unused cells or wires in module \gost89_cfb..
Removed 0 unused cells and 4 unused wires.
<suppressed ~1 debug messages>

yosys> opt_expr

3.99. Executing OPT_EXPR pass (perform const folding).
Optimizing module gost89_cfb.
MAX OPT ITERATION = 1

yosys> abc -dff

3.100. Executing ABC pass (technology mapping using ABC).

3.100.1. Summary of detected clock domains:
  647 cells in clk=\clk, en=$auto$opt_dff.cc:219:make_patterns_logic$2470, arst={ }, srst={ }
  389 cells in clk=\clk, en={ }, arst={ }, srst={ }
  67 cells in clk=\clk, en=$verific$n347$15, arst={ }, srst={ }
  130 cells in clk=\clk, en=\ecb_encrypt.load_data, arst={ }, srst={ }
  131 cells in clk=\clk, en=$auto$opt_dff.cc:194:make_patterns_logic$2459, arst={ }, srst={ }
  561 cells in clk=\clk, en=$auto$opt_dff.cc:194:make_patterns_logic$2465, arst={ }, srst={ }
  3 cells in clk=\clk, en=$auto$opt_dff.cc:194:make_patterns_logic$2462, arst={ }, srst={ }

3.100.2. Extracting gate netlist of module `\gost89_cfb' to `<abc-temp-dir>/input.blif'..
Found matching posedge clock domain: \clk, enabled by $auto$opt_dff.cc:219:make_patterns_logic$2470
Extracted 647 gates and 1326 wires to a netlist network with 679 inputs and 97 outputs.

3.100.2.1. Executing ABC.

3.100.3. Extracting gate netlist of module `\gost89_cfb' to `<abc-temp-dir>/input.blif'..
Found matching posedge clock domain: \clk
Extracted 357 gates and 488 wires to a netlist network with 130 inputs and 111 outputs.

3.100.3.1. Executing ABC.

3.100.4. Extracting gate netlist of module `\gost89_cfb' to `<abc-temp-dir>/input.blif'..
Found matching posedge clock domain: \clk, enabled by $verific$n347$15
Extracted 67 gates and 135 wires to a netlist network with 68 inputs and 65 outputs.

3.100.4.1. Executing ABC.

3.100.5. Extracting gate netlist of module `\gost89_cfb' to `<abc-temp-dir>/input.blif'..
Found matching posedge clock domain: \clk, enabled by \ecb_encrypt.load_data
Extracted 130 gates and 261 wires to a netlist network with 131 inputs and 130 outputs.

3.100.5.1. Executing ABC.

3.100.6. Extracting gate netlist of module `\gost89_cfb' to `<abc-temp-dir>/input.blif'..
Found matching posedge clock domain: \clk, enabled by $auto$opt_dff.cc:194:make_patterns_logic$2459
Extracted 131 gates and 262 wires to a netlist network with 131 inputs and 66 outputs.

3.100.6.1. Executing ABC.

3.100.7. Extracting gate netlist of module `\gost89_cfb' to `<abc-temp-dir>/input.blif'..
Found matching posedge clock domain: \clk, enabled by $auto$opt_dff.cc:194:make_patterns_logic$2465
Extracted 561 gates and 829 wires to a netlist network with 268 inputs and 33 outputs.

3.100.7.1. Executing ABC.

3.100.8. Extracting gate netlist of module `\gost89_cfb' to `<abc-temp-dir>/input.blif'..
Found matching posedge clock domain: \clk, enabled by $auto$opt_dff.cc:194:make_patterns_logic$2462
Extracted 3 gates and 7 wires to a netlist network with 3 inputs and 2 outputs.

3.100.8.1. Executing ABC.

yosys> abc -dff

3.101. Executing ABC pass (technology mapping using ABC).

3.101.1. Summary of detected clock domains:
  176 cells in clk=\clk, en=$abc$7207$ecb_encrypt.load_data, arst={ }, srst={ }
  84 cells in clk=\clk, en=$abc$7011$verific$n347$15, arst={ }, srst={ }
  76 cells in clk=\clk, en=$abc$5789$auto$opt_dff.cc:219:make_patterns_logic$2470, arst={ }, srst={ }
  149 cells in clk=\clk, en=$abc$7466$auto$opt_dff.cc:194:make_patterns_logic$2459, arst={ }, srst={ }
  995 cells in clk=\clk, en={ }, arst={ }, srst={ }
  576 cells in clk=\clk, en=$abc$7662$auto$opt_dff.cc:194:make_patterns_logic$2465, arst={ }, srst={ }
  4 cells in clk=\clk, en=$abc$8269$auto$opt_dff.cc:194:make_patterns_logic$2462, arst={ }, srst={ }

3.101.2. Extracting gate netlist of module `\gost89_cfb' to `<abc-temp-dir>/input.blif'..
Found matching posedge clock domain: \clk, enabled by $abc$7207$ecb_encrypt.load_data
Extracted 176 gates and 307 wires to a netlist network with 131 inputs and 129 outputs.

3.101.2.1. Executing ABC.

3.101.3. Extracting gate netlist of module `\gost89_cfb' to `<abc-temp-dir>/input.blif'..
Found matching posedge clock domain: \clk, enabled by $abc$7011$verific$n347$15
Extracted 84 gates and 167 wires to a netlist network with 83 inputs and 81 outputs.

3.101.3.1. Executing ABC.

3.101.4. Extracting gate netlist of module `\gost89_cfb' to `<abc-temp-dir>/input.blif'..
Found matching posedge clock domain: \clk, enabled by $abc$5789$auto$opt_dff.cc:219:make_patterns_logic$2470
Extracted 76 gates and 153 wires to a netlist network with 77 inputs and 65 outputs.

3.101.4.1. Executing ABC.

3.101.5. Extracting gate netlist of module `\gost89_cfb' to `<abc-temp-dir>/input.blif'..
Found matching posedge clock domain: \clk, enabled by $abc$7466$auto$opt_dff.cc:194:make_patterns_logic$2459
Extracted 149 gates and 300 wires to a netlist network with 151 inputs and 65 outputs.

3.101.5.1. Executing ABC.

3.101.6. Extracting gate netlist of module `\gost89_cfb' to `<abc-temp-dir>/input.blif'..
Found matching posedge clock domain: \clk
Extracted 963 gates and 1601 wires to a netlist network with 638 inputs and 134 outputs.

3.101.6.1. Executing ABC.

3.101.7. Extracting gate netlist of module `\gost89_cfb' to `<abc-temp-dir>/input.blif'..
Found matching posedge clock domain: \clk, enabled by $abc$7662$auto$opt_dff.cc:194:make_patterns_logic$2465
Extracted 576 gates and 846 wires to a netlist network with 270 inputs and 33 outputs.

3.101.7.1. Executing ABC.

3.101.8. Extracting gate netlist of module `\gost89_cfb' to `<abc-temp-dir>/input.blif'..
Found matching posedge clock domain: \clk, enabled by $abc$8269$auto$opt_dff.cc:194:make_patterns_logic$2462
Extracted 4 gates and 8 wires to a netlist network with 4 inputs and 3 outputs.

3.101.8.1. Executing ABC.

yosys> abc -dff

3.102. Executing ABC pass (technology mapping using ABC).

3.102.1. Summary of detected clock domains:
  194 cells in clk=\clk, en=$abc$8274$abc$7207$ecb_encrypt.load_data, arst={ }, srst={ }
  161 cells in clk=\clk, en=$abc$8939$abc$7466$auto$opt_dff.cc:194:make_patterns_logic$2459, arst={ }, srst={ }
  73 cells in clk=\clk, en=$abc$8532$abc$7011$verific$n347$15, arst={ }, srst={ }
  904 cells in clk=\clk, en={ }, arst={ }, srst={ }
  209 cells in clk=\clk, en=$abc$8743$abc$5789$auto$opt_dff.cc:219:make_patterns_logic$2470, arst={ }, srst={ }
  535 cells in clk=\clk, en=$abc$10205$abc$7662$auto$opt_dff.cc:194:make_patterns_logic$2465, arst={ }, srst={ }
  4 cells in clk=\clk, en=$abc$10770$abc$8269$auto$opt_dff.cc:194:make_patterns_logic$2462, arst={ }, srst={ }

3.102.2. Extracting gate netlist of module `\gost89_cfb' to `<abc-temp-dir>/input.blif'..
Found matching posedge clock domain: \clk, enabled by $abc$8274$abc$7207$ecb_encrypt.load_data
Extracted 194 gates and 325 wires to a netlist network with 131 inputs and 129 outputs.

3.102.2.1. Executing ABC.

3.102.3. Extracting gate netlist of module `\gost89_cfb' to `<abc-temp-dir>/input.blif'..
Found matching posedge clock domain: \clk, enabled by $abc$8939$abc$7466$auto$opt_dff.cc:194:make_patterns_logic$2459
Extracted 161 gates and 300 wires to a netlist network with 139 inputs and 66 outputs.

3.102.3.1. Executing ABC.

3.102.4. Extracting gate netlist of module `\gost89_cfb' to `<abc-temp-dir>/input.blif'..
Found matching posedge clock domain: \clk, enabled by $abc$8532$abc$7011$verific$n347$15
Extracted 73 gates and 147 wires to a netlist network with 74 inputs and 65 outputs.

3.102.4.1. Executing ABC.

3.102.5. Extracting gate netlist of module `\gost89_cfb' to `<abc-temp-dir>/input.blif'..
Found matching posedge clock domain: \clk
Extracted 872 gates and 1420 wires to a netlist network with 548 inputs and 114 outputs.

3.102.5.1. Executing ABC.

3.102.6. Extracting gate netlist of module `\gost89_cfb' to `<abc-temp-dir>/input.blif'..
Found matching posedge clock domain: \clk, enabled by $abc$8743$abc$5789$auto$opt_dff.cc:219:make_patterns_logic$2470
Extracted 209 gates and 397 wires to a netlist network with 188 inputs and 71 outputs.

3.102.6.1. Executing ABC.

3.102.7. Extracting gate netlist of module `\gost89_cfb' to `<abc-temp-dir>/input.blif'..
Found matching posedge clock domain: \clk, enabled by $abc$10205$abc$7662$auto$opt_dff.cc:194:make_patterns_logic$2465
Extracted 535 gates and 806 wires to a netlist network with 271 inputs and 33 outputs.

3.102.7.1. Executing ABC.

3.102.8. Extracting gate netlist of module `\gost89_cfb' to `<abc-temp-dir>/input.blif'..
Found matching posedge clock domain: \clk, enabled by $abc$10770$abc$8269$auto$opt_dff.cc:194:make_patterns_logic$2462
Extracted 4 gates and 8 wires to a netlist network with 4 inputs and 3 outputs.

3.102.8.1. Executing ABC.

yosys> abc -dff

3.103. Executing ABC pass (technology mapping using ABC).

3.103.1. Summary of detected clock domains:
  137 cells in clk=\clk, en=$abc$10776$abc$8274$abc$7207$ecb_encrypt.load_data, arst={ }, srst={ }
  174 cells in clk=\clk, en=$abc$11041$abc$8939$abc$7466$auto$opt_dff.cc:194:make_patterns_logic$2459, arst={ }, srst={ }
  103 cells in clk=\clk, en=$abc$11237$abc$8532$abc$7011$verific$n347$15, arst={ }, srst={ }
  867 cells in clk=\clk, en={ }, arst={ }, srst={ }
  359 cells in clk=\clk, en=$abc$12442$abc$8743$abc$5789$auto$opt_dff.cc:219:make_patterns_logic$2470, arst={ }, srst={ }
  564 cells in clk=\clk, en=$abc$12776$abc$10205$abc$7662$auto$opt_dff.cc:194:make_patterns_logic$2465, arst={ }, srst={ }
  4 cells in clk=\clk, en=$abc$13370$abc$10770$abc$8269$auto$opt_dff.cc:194:make_patterns_logic$2462, arst={ }, srst={ }

3.103.2. Extracting gate netlist of module `\gost89_cfb' to `<abc-temp-dir>/input.blif'..
Found matching posedge clock domain: \clk, enabled by $abc$10776$abc$8274$abc$7207$ecb_encrypt.load_data
Extracted 137 gates and 268 wires to a netlist network with 131 inputs and 129 outputs.

3.103.2.1. Executing ABC.

3.103.3. Extracting gate netlist of module `\gost89_cfb' to `<abc-temp-dir>/input.blif'..
Found matching posedge clock domain: \clk, enabled by $abc$11041$abc$8939$abc$7466$auto$opt_dff.cc:194:make_patterns_logic$2459
Extracted 174 gates and 318 wires to a netlist network with 144 inputs and 66 outputs.

3.103.3.1. Executing ABC.

3.103.4. Extracting gate netlist of module `\gost89_cfb' to `<abc-temp-dir>/input.blif'..
Found matching posedge clock domain: \clk, enabled by $abc$11237$abc$8532$abc$7011$verific$n347$15
Extracted 103 gates and 207 wires to a netlist network with 104 inputs and 95 outputs.

3.103.4.1. Executing ABC.

3.103.5. Extracting gate netlist of module `\gost89_cfb' to `<abc-temp-dir>/input.blif'..
Found matching posedge clock domain: \clk
Extracted 835 gates and 1309 wires to a netlist network with 474 inputs and 126 outputs.

3.103.5.1. Executing ABC.

3.103.6. Extracting gate netlist of module `\gost89_cfb' to `<abc-temp-dir>/input.blif'..
Found matching posedge clock domain: \clk, enabled by $abc$12442$abc$8743$abc$5789$auto$opt_dff.cc:219:make_patterns_logic$2470
Extracted 359 gates and 663 wires to a netlist network with 304 inputs and 84 outputs.

3.103.6.1. Executing ABC.

3.103.7. Extracting gate netlist of module `\gost89_cfb' to `<abc-temp-dir>/input.blif'..
Found matching posedge clock domain: \clk, enabled by $abc$12776$abc$10205$abc$7662$auto$opt_dff.cc:194:make_patterns_logic$2465
Extracted 564 gates and 835 wires to a netlist network with 271 inputs and 33 outputs.

3.103.7.1. Executing ABC.

3.103.8. Extracting gate netlist of module `\gost89_cfb' to `<abc-temp-dir>/input.blif'..
Found matching posedge clock domain: \clk, enabled by $abc$13370$abc$10770$abc$8269$auto$opt_dff.cc:194:make_patterns_logic$2462
Extracted 4 gates and 8 wires to a netlist network with 4 inputs and 3 outputs.

3.103.8.1. Executing ABC.

yosys> opt_ffinv

3.104. Executing OPT_FFINV pass (push inverters through FFs).
Discovering LUTs.
Pushed 0 inverters.

yosys> opt_expr

3.105. Executing OPT_EXPR pass (perform const folding).
Optimizing module gost89_cfb.
<suppressed ~27 debug messages>

yosys> opt_merge -nomux

3.106. Executing OPT_MERGE pass (detect identical cells).
Finding identical cells in module `\gost89_cfb'.
<suppressed ~135 debug messages>
Removed a total of 45 cells.

yosys> opt_muxtree

3.107. Executing OPT_MUXTREE pass (detect dead branches in mux trees).
Running muxtree optimizer on module \gost89_cfb..
  Creating internal representation of mux trees.
  No muxes found in this module.
Removed 0 multiplexer ports.

yosys> opt_reduce

3.108. Executing OPT_REDUCE pass (consolidate $*mux and $reduce_* inputs).
  Optimizing cells in module \gost89_cfb.
Performed a total of 0 changes.

yosys> opt_merge

3.109. Executing OPT_MERGE pass (detect identical cells).
Finding identical cells in module `\gost89_cfb'.
Removed a total of 0 cells.

yosys> opt_share

3.110. Executing OPT_SHARE pass.

yosys> opt_dff -nosdff -sat

3.111. Executing OPT_DFF pass (perform DFF optimizations).
Adding EN signal on $abc$14055$auto$blifparse.cc:362:parse_blif$14115 ($_DFF_P_) from module gost89_cfb (D = $abc$14055$li59_li59, Q = $abc$14055$lo59).
Adding EN signal on $abc$14055$auto$blifparse.cc:362:parse_blif$14113 ($_DFF_P_) from module gost89_cfb (D = $abc$14055$li57_li57, Q = $abc$14055$lo57).
Adding EN signal on $abc$14055$auto$blifparse.cc:362:parse_blif$14111 ($_DFF_P_) from module gost89_cfb (D = $abc$14055$li55_li55, Q = $abc$14055$lo55).
Adding EN signal on $abc$14055$auto$blifparse.cc:362:parse_blif$14110 ($_DFF_P_) from module gost89_cfb (D = $abc$14055$li54_li54, Q = $abc$14055$lo54).
Adding EN signal on $abc$14055$auto$blifparse.cc:362:parse_blif$14109 ($_DFF_P_) from module gost89_cfb (D = $abc$14055$li53_li53, Q = $abc$14055$lo53).
Adding EN signal on $abc$14055$auto$blifparse.cc:362:parse_blif$14108 ($_DFF_P_) from module gost89_cfb (D = $abc$14055$li52_li52, Q = $abc$14055$lo52).
Adding EN signal on $abc$14055$auto$blifparse.cc:362:parse_blif$14107 ($_DFF_P_) from module gost89_cfb (D = $abc$14055$li51_li51, Q = $abc$14055$lo51).
Adding EN signal on $abc$14055$auto$blifparse.cc:362:parse_blif$14106 ($_DFF_P_) from module gost89_cfb (D = $abc$14055$li50_li50, Q = $abc$14055$lo50).
Adding EN signal on $abc$14055$auto$blifparse.cc:362:parse_blif$14105 ($_DFF_P_) from module gost89_cfb (D = $abc$14055$li49_li49, Q = $abc$14055$lo49).
Adding EN signal on $abc$14055$auto$blifparse.cc:362:parse_blif$14104 ($_DFF_P_) from module gost89_cfb (D = $abc$14055$li48_li48, Q = $abc$14055$lo48).
Adding EN signal on $abc$14055$auto$blifparse.cc:362:parse_blif$14102 ($_DFF_P_) from module gost89_cfb (D = $abc$14055$li46_li46, Q = $abc$14055$lo46).
Adding EN signal on $abc$14055$auto$blifparse.cc:362:parse_blif$14122 ($_DFF_P_) from module gost89_cfb (D = $abc$14055$li66_li66, Q = $abc$14055$lo66).
Adding EN signal on $abc$14055$auto$blifparse.cc:362:parse_blif$14101 ($_DFF_P_) from module gost89_cfb (D = $abc$14055$li45_li45, Q = $abc$14055$lo45).
Adding EN signal on $abc$14055$auto$blifparse.cc:362:parse_blif$14100 ($_DFF_P_) from module gost89_cfb (D = $abc$14055$li44_li44, Q = $abc$14055$lo44).
Adding EN signal on $abc$14055$auto$blifparse.cc:362:parse_blif$14098 ($_DFF_P_) from module gost89_cfb (D = $abc$14055$li42_li42, Q = $abc$14055$lo42).
Adding EN signal on $abc$14055$auto$blifparse.cc:362:parse_blif$14097 ($_DFF_P_) from module gost89_cfb (D = $abc$14055$li41_li41, Q = $abc$14055$lo41).
Adding EN signal on $abc$14055$auto$blifparse.cc:362:parse_blif$14096 ($_DFF_P_) from module gost89_cfb (D = $abc$14055$li40_li40, Q = $abc$14055$lo40).
Adding EN signal on $abc$14055$auto$blifparse.cc:362:parse_blif$14121 ($_DFF_P_) from module gost89_cfb (D = $abc$14055$li65_li65, Q = $abc$14055$lo65).
Adding EN signal on $abc$14055$auto$blifparse.cc:362:parse_blif$14125 ($_DFF_P_) from module gost89_cfb (D = $abc$14055$li69_li69, Q = $abc$14055$lo69).
Adding EN signal on $abc$14055$auto$blifparse.cc:362:parse_blif$14088 ($_DFF_P_) from module gost89_cfb (D = $abc$14055$li32_li32, Q = $abc$14055$lo32).
Adding EN signal on $abc$14055$auto$blifparse.cc:362:parse_blif$14126 ($_DFF_P_) from module gost89_cfb (D = $abc$14055$li70_li70, Q = $abc$14055$lo70).

yosys> opt_clean

3.112. Executing OPT_CLEAN pass (remove unused cells and wires).
Finding unused cells or wires in module \gost89_cfb..
Removed 1 unused cells and 13960 unused wires.
<suppressed ~18 debug messages>

yosys> opt_expr

3.113. Executing OPT_EXPR pass (perform const folding).
Optimizing module gost89_cfb.
<suppressed ~42 debug messages>

yosys> opt_muxtree

3.114. Executing OPT_MUXTREE pass (detect dead branches in mux trees).
Running muxtree optimizer on module \gost89_cfb..
  Creating internal representation of mux trees.
  No muxes found in this module.
Removed 0 multiplexer ports.

yosys> opt_reduce

3.115. Executing OPT_REDUCE pass (consolidate $*mux and $reduce_* inputs).
  Optimizing cells in module \gost89_cfb.
Performed a total of 0 changes.

yosys> opt_merge

3.116. Executing OPT_MERGE pass (detect identical cells).
Finding identical cells in module `\gost89_cfb'.
<suppressed ~60 debug messages>
Removed a total of 20 cells.

yosys> opt_share

3.117. Executing OPT_SHARE pass.

yosys> opt_dff -nosdff -sat

3.118. Executing OPT_DFF pass (perform DFF optimizations).
Adding EN signal on $abc$14055$auto$blifparse.cc:362:parse_blif$14103 ($_DFF_P_) from module gost89_cfb (D = $abc$11432$li46_li46, Q = $abc$11432$lo46).
Adding EN signal on $abc$14055$auto$blifparse.cc:362:parse_blif$14099 ($_DFF_P_) from module gost89_cfb (D = $abc$11432$li42_li42, Q = $abc$11432$lo42).
Adding EN signal on $abc$14055$auto$blifparse.cc:362:parse_blif$14090 ($_DFF_P_) from module gost89_cfb (D = $abc$11432$li33_li33, Q = $abc$11432$lo33).
Adding EN signal on $abc$14055$auto$blifparse.cc:362:parse_blif$14089 ($_DFF_P_) from module gost89_cfb (D = $abc$11432$li32_li32, Q = $abc$14055$lo33).
Adding EN signal on $abc$14055$auto$blifparse.cc:362:parse_blif$14079 ($_DFF_P_) from module gost89_cfb (D = $abc$11432$li23_li23, Q = $abc$11432$lo23).
Adding EN signal on $abc$14055$auto$blifparse.cc:362:parse_blif$14069 ($_DFF_P_) from module gost89_cfb (D = $abc$11041$abc$9134$li64_li64, Q = $abc$11432$abc$9134$lo64).
Adding EN signal on $abc$14055$auto$blifparse.cc:362:parse_blif$14066 ($_DFF_P_) from module gost89_cfb (D = $abc$11041$abc$9134$li70_li70, Q = $abc$11432$abc$9134$lo70).
Adding EN signal on $abc$14055$auto$blifparse.cc:362:parse_blif$14063 ($_DFF_P_) from module gost89_cfb (D = $abc$11041$abc$9134$li61_li61, Q = $abc$11432$abc$9134$lo61).
Adding EN signal on $abc$14055$auto$blifparse.cc:362:parse_blif$14062 ($_DFF_P_) from module gost89_cfb (D = $abc$11041$abc$9134$li62_li62, Q = $abc$11432$abc$9134$lo62).
Adding EN signal on $abc$14055$auto$blifparse.cc:362:parse_blif$14060 ($_DFF_P_) from module gost89_cfb (D = $abc$11041$abc$9134$li60_li60, Q = $abc$14055$lo04).
Adding EN signal on $abc$14055$auto$blifparse.cc:362:parse_blif$14058 ($_DFF_P_) from module gost89_cfb (D = $abc$11041$abc$9134$li50_li50, Q = \ecb_encrypt.n1 [20]).
Adding EN signal on $abc$14055$auto$blifparse.cc:362:parse_blif$14057 ($_DFF_P_) from module gost89_cfb (D = $abc$11041$abc$9134$li52_li52, Q = $abc$11432$abc$9134$lo52).

yosys> opt_clean

3.119. Executing OPT_CLEAN pass (remove unused cells and wires).
Finding unused cells or wires in module \gost89_cfb..
Removed 0 unused cells and 53 unused wires.
<suppressed ~1 debug messages>

yosys> opt_expr

3.120. Executing OPT_EXPR pass (perform const folding).
Optimizing module gost89_cfb.
<suppressed ~24 debug messages>

yosys> opt_muxtree

3.121. Executing OPT_MUXTREE pass (detect dead branches in mux trees).
Running muxtree optimizer on module \gost89_cfb..
  Creating internal representation of mux trees.
  No muxes found in this module.
Removed 0 multiplexer ports.

yosys> opt_reduce

3.122. Executing OPT_REDUCE pass (consolidate $*mux and $reduce_* inputs).
  Optimizing cells in module \gost89_cfb.
Performed a total of 0 changes.

yosys> opt_merge

3.123. Executing OPT_MERGE pass (detect identical cells).
Finding identical cells in module `\gost89_cfb'.
<suppressed ~36 debug messages>
Removed a total of 12 cells.

yosys> opt_share

3.124. Executing OPT_SHARE pass.

yosys> opt_dff -nosdff -sat

3.125. Executing OPT_DFF pass (perform DFF optimizations).

yosys> opt_clean

3.126. Executing OPT_CLEAN pass (remove unused cells and wires).
Finding unused cells or wires in module \gost89_cfb..
Removed 0 unused cells and 24 unused wires.
<suppressed ~1 debug messages>

yosys> opt_expr

3.127. Executing OPT_EXPR pass (perform const folding).
Optimizing module gost89_cfb.

yosys> opt_muxtree

3.128. Executing OPT_MUXTREE pass (detect dead branches in mux trees).
Running muxtree optimizer on module \gost89_cfb..
  Creating internal representation of mux trees.
  No muxes found in this module.
Removed 0 multiplexer ports.

yosys> opt_reduce

3.129. Executing OPT_REDUCE pass (consolidate $*mux and $reduce_* inputs).
  Optimizing cells in module \gost89_cfb.
Performed a total of 0 changes.

yosys> opt_merge

3.130. Executing OPT_MERGE pass (detect identical cells).
Finding identical cells in module `\gost89_cfb'.
Removed a total of 0 cells.

yosys> opt_share

3.131. Executing OPT_SHARE pass.

yosys> opt_dff -nosdff -sat

3.132. Executing OPT_DFF pass (perform DFF optimizations).

yosys> opt_clean

3.133. Executing OPT_CLEAN pass (remove unused cells and wires).
Finding unused cells or wires in module \gost89_cfb..

yosys> opt_expr

3.134. Executing OPT_EXPR pass (perform const folding).
Optimizing module gost89_cfb.
MAX OPT ITERATION = 4

yosys> bmuxmap

3.135. Executing BMUXMAP pass.

yosys> demuxmap

3.136. Executing DEMUXMAP pass.

yosys> clean_zerowidth

yosys> abc -script /tmp/yosys_959hrK/abc_tmp_1.scr

3.137. Executing ABC pass (technology mapping using ABC).

3.137.1. Extracting gate netlist of module `\gost89_cfb' to `<abc-temp-dir>/input.blif'..
Extracted 1816 gates and 2979 wires to a netlist network with 1162 inputs and 301 outputs.

3.137.1.1. Executing ABC.
DE:   #PIs = 1162  #Luts =   600  Max Lvl =   5  Avg Lvl =   2.32  [   0.15 sec. at Pass 0]
DE:   #PIs = 1162  #Luts =   559  Max Lvl =   5  Avg Lvl =   2.18  [   1.81 sec. at Pass 1]
DE:   #PIs = 1162  #Luts =   559  Max Lvl =   5  Avg Lvl =   2.18  [   0.49 sec. at Pass 2]
DE:   #PIs = 1162  #Luts =   552  Max Lvl =   5  Avg Lvl =   2.18  [   0.87 sec. at Pass 3]
DE:   #PIs = 1162  #Luts =   551  Max Lvl =   5  Avg Lvl =   2.18  [   1.23 sec. at Pass 4]
DE:   #PIs = 1162  #Luts =   539  Max Lvl =   5  Avg Lvl =   2.18  [   1.15 sec. at Pass 5]
DE:   #PIs = 1162  #Luts =   539  Max Lvl =   5  Avg Lvl =   2.18  [   1.93 sec. at Pass 6]
DE:   #PIs = 1162  #Luts =   539  Max Lvl =   5  Avg Lvl =   2.18  [   1.16 sec. at Pass 7]
DE:   #PIs = 1162  #Luts =   539  Max Lvl =   5  Avg Lvl =   2.18  [   0.99 sec. at Pass 8]
DE:   #PIs = 1162  #Luts =   538  Max Lvl =   5  Avg Lvl =   2.18  [   5.23 sec. at Pass 9]
DE:   #PIs = 1162  #Luts =   538  Max Lvl =   5  Avg Lvl =   2.18  [   1.41 sec. at Pass 10]
DE:   #PIs = 1162  #Luts =   538  Max Lvl =   5  Avg Lvl =   2.18  [   1.67 sec. at Pass 11]
DE:   #PIs = 1162  #Luts =   538  Max Lvl =   5  Avg Lvl =   2.18  [   1.93 sec. at Pass 12]
DE:   #PIs = 1162  #Luts =   538  Max Lvl =   5  Avg Lvl =   2.18  [   6.36 sec. at Pass 13]
DE:   #PIs = 1162  #Luts =   538  Max Lvl =   5  Avg Lvl =   2.18  [   0.50 sec. at Pass 14]

yosys> opt_expr

3.138. Executing OPT_EXPR pass (perform const folding).
Optimizing module gost89_cfb.

yosys> opt_merge -nomux

3.139. Executing OPT_MERGE pass (detect identical cells).
Finding identical cells in module `\gost89_cfb'.
Removed a total of 0 cells.

yosys> opt_muxtree

3.140. Executing OPT_MUXTREE pass (detect dead branches in mux trees).
Running muxtree optimizer on module \gost89_cfb..
  Creating internal representation of mux trees.
  No muxes found in this module.
Removed 0 multiplexer ports.

yosys> opt_reduce

3.141. Executing OPT_REDUCE pass (consolidate $*mux and $reduce_* inputs).
  Optimizing cells in module \gost89_cfb.
Performed a total of 0 changes.

yosys> opt_merge

3.142. Executing OPT_MERGE pass (detect identical cells).
Finding identical cells in module `\gost89_cfb'.
Removed a total of 0 cells.

yosys> opt_share

3.143. Executing OPT_SHARE pass.

yosys> opt_dff -nosdff -nodffe

3.144. Executing OPT_DFF pass (perform DFF optimizations).

yosys> opt_clean

3.145. Executing OPT_CLEAN pass (remove unused cells and wires).
Finding unused cells or wires in module \gost89_cfb..
Removed 0 unused cells and 2976 unused wires.
<suppressed ~1 debug messages>

yosys> opt_expr

3.146. Executing OPT_EXPR pass (perform const folding).
Optimizing module gost89_cfb.
MAX OPT ITERATION = 1

yosys> opt_ffinv

3.147. Executing OPT_FFINV pass (push inverters through FFs).
Discovering LUTs.
Pushed 0 inverters.

yosys> stat

3.148. Printing statistics.

=== gost89_cfb ===

   Number of wires:                782
   Number of wire bits:           3948
   Number of public wires:          46
   Number of public wire bits:    3149
   Number of memories:               0
   Number of memory bits:            0
   Number of processes:              0
   Number of cells:                929
     $_DFFE_PP_                    322
     $_DFF_P_                       38
     $lut                          537
     adder_carry                    32


yosys> shregmap -minlen 8 -maxlen 20

3.149. Executing SHREGMAP pass (map shift registers).
Converted 0 dff cells into 0 shift registers.

yosys> dfflegalize -cell $_DFF_?_ 0 -cell $_DFF_???_ 0 -cell $_DFFE_????_ 0 -cell $_DFFSR_???_ 0 -cell $_DFFSRE_????_ 0 -cell $_DLATCHSR_PPP_ 0

3.150. Executing DFFLEGALIZE pass (convert FFs to types supported by the target).

yosys> stat

3.151. Printing statistics.

=== gost89_cfb ===

   Number of wires:                782
   Number of wire bits:           3948
   Number of public wires:          46
   Number of public wire bits:    3149
   Number of memories:               0
   Number of memory bits:            0
   Number of processes:              0
   Number of cells:                929
     $_DFFE_PP0P_                  322
     $_DFF_P_                       38
     $lut                          537
     adder_carry                    32


yosys> techmap -map +/techmap.v -map +/rapidsilicon/genesis/ffs_map.v

3.152. Executing TECHMAP pass (map to technology primitives).

3.152.1. Executing Verilog-2005 frontend: /nfs_scratch/scratch/Vorak/aram/Workspace/yosys_verific_rs/yosys/install/bin/../share/yosys/techmap.v
Parsing Verilog input from `/nfs_scratch/scratch/Vorak/aram/Workspace/yosys_verific_rs/yosys/install/bin/../share/yosys/techmap.v' to AST representation.
Generating RTLIL representation for module `\_90_simplemap_bool_ops'.
Generating RTLIL representation for module `\_90_simplemap_reduce_ops'.
Generating RTLIL representation for module `\_90_simplemap_logic_ops'.
Generating RTLIL representation for module `\_90_simplemap_compare_ops'.
Generating RTLIL representation for module `\_90_simplemap_various'.
Generating RTLIL representation for module `\_90_simplemap_registers'.
Generating RTLIL representation for module `\_90_shift_ops_shr_shl_sshl_sshr'.
Generating RTLIL representation for module `\_90_shift_shiftx'.
Generating RTLIL representation for module `\_90_fa'.
Generating RTLIL representation for module `\_90_lcu'.
Generating RTLIL representation for module `\_90_alu'.
Generating RTLIL representation for module `\_90_macc'.
Generating RTLIL representation for module `\_90_alumacc'.
Generating RTLIL representation for module `\$__div_mod_u'.
Generating RTLIL representation for module `\$__div_mod_trunc'.
Generating RTLIL representation for module `\_90_div'.
Generating RTLIL representation for module `\_90_mod'.
Generating RTLIL representation for module `\$__div_mod_floor'.
Generating RTLIL representation for module `\_90_divfloor'.
Generating RTLIL representation for module `\_90_modfloor'.
Generating RTLIL representation for module `\_90_pow'.
Generating RTLIL representation for module `\_90_pmux'.
Generating RTLIL representation for module `\_90_demux'.
Generating RTLIL representation for module `\_90_lut'.
Successfully finished Verilog frontend.

3.152.2. Executing Verilog-2005 frontend: /nfs_scratch/scratch/Vorak/aram/Workspace/yosys_verific_rs/yosys/install/bin/../share/yosys/rapidsilicon/genesis/ffs_map.v
Parsing Verilog input from `/nfs_scratch/scratch/Vorak/aram/Workspace/yosys_verific_rs/yosys/install/bin/../share/yosys/rapidsilicon/genesis/ffs_map.v' to AST representation.
Generating RTLIL representation for module `\$_DFF_P_'.
Generating RTLIL representation for module `\$_DFF_PP0_'.
Generating RTLIL representation for module `\$_DFF_PN0_'.
Generating RTLIL representation for module `\$_DFF_PP1_'.
Generating RTLIL representation for module `\$_DFF_PN1_'.
Generating RTLIL representation for module `\$_DFFE_PP_'.
Generating RTLIL representation for module `\$_DFFE_PN_'.
Generating RTLIL representation for module `\$_DFFE_PP0P_'.
Generating RTLIL representation for module `\$_DFFE_PP0N_'.
Generating RTLIL representation for module `\$_DFFE_PN0P_'.
Generating RTLIL representation for module `\$_DFFE_PN0N_'.
Generating RTLIL representation for module `\$_DFFE_PP1P_'.
Generating RTLIL representation for module `\$_DFFE_PP1N_'.
Generating RTLIL representation for module `\$_DFFE_PN1P_'.
Generating RTLIL representation for module `\$_DFFE_PN1N_'.
Generating RTLIL representation for module `\$_DFFSR_PPP_'.
Generating RTLIL representation for module `\$_DFFSR_PNP_'.
Generating RTLIL representation for module `\$_DFFSR_PNN_'.
Generating RTLIL representation for module `\$_DFFSR_PPN_'.
Generating RTLIL representation for module `\$_DFFSR_NPP_'.
Generating RTLIL representation for module `\$_DFFSR_NNP_'.
Generating RTLIL representation for module `\$_DFFSR_NNN_'.
Generating RTLIL representation for module `\$_DFFSR_NPN_'.
Generating RTLIL representation for module `\$_DFFSRE_PPPP_'.
Generating RTLIL representation for module `\$_DFFSRE_PNPP_'.
Generating RTLIL representation for module `\$_DFFSRE_PPNP_'.
Generating RTLIL representation for module `\$_DFFSRE_PNNP_'.
Generating RTLIL representation for module `\$_DFFSRE_PPPN_'.
Generating RTLIL representation for module `\$_DFFSRE_PNPN_'.
Generating RTLIL representation for module `\$_DFFSRE_PPNN_'.
Generating RTLIL representation for module `\$_DFFSRE_PNNN_'.
Generating RTLIL representation for module `\$_DLATCHSR_PPP_'.
Generating RTLIL representation for module `\$_DLATCHSR_NPP_'.
Generating RTLIL representation for module `\$_DFF_N_'.
Generating RTLIL representation for module `\$_DFF_NP0_'.
Generating RTLIL representation for module `\$_DFF_NN0_'.
Generating RTLIL representation for module `\$_DFF_NP1_'.
Generating RTLIL representation for module `\$_DFF_NN1_'.
Generating RTLIL representation for module `\$_DFFE_NP_'.
Generating RTLIL representation for module `\$_DFFE_NN_'.
Generating RTLIL representation for module `\$_DFFE_NP0P_'.
Generating RTLIL representation for module `\$_DFFE_NP0N_'.
Generating RTLIL representation for module `\$_DFFE_NN0P_'.
Generating RTLIL representation for module `\$_DFFE_NN0N_'.
Generating RTLIL representation for module `\$_DFFE_NP1P_'.
Generating RTLIL representation for module `\$_DFFE_NP1N_'.
Generating RTLIL representation for module `\$_DFFE_NN1P_'.
Generating RTLIL representation for module `\$_DFFE_NN1N_'.
Generating RTLIL representation for module `\$_DFFSRE_NPPP_'.
Generating RTLIL representation for module `\$_DFFSRE_NNPP_'.
Generating RTLIL representation for module `\$_DFFSRE_NPNP_'.
Generating RTLIL representation for module `\$_DFFSRE_NNNP_'.
Generating RTLIL representation for module `\$_DFFSRE_NPPN_'.
Generating RTLIL representation for module `\$_DFFSRE_NNPN_'.
Generating RTLIL representation for module `\$_DFFSRE_NPNN_'.
Generating RTLIL representation for module `\$_DFFSRE_NNNN_'.
Generating RTLIL representation for module `\$__SHREG_DFF_P_'.
Generating RTLIL representation for module `\$_SDFF_PP0_'.
Generating RTLIL representation for module `\$_SDFF_PN0_'.
Generating RTLIL representation for module `\$_SDFF_NP0_'.
Generating RTLIL representation for module `\$_SDFF_NN0_'.
Generating RTLIL representation for module `\$_SDFF_PP1_'.
Generating RTLIL representation for module `\$_SDFF_PN1_'.
Generating RTLIL representation for module `\$_SDFF_NP1_'.
Generating RTLIL representation for module `\$_SDFF_NN1_'.
Successfully finished Verilog frontend.

3.152.3. Continuing TECHMAP pass.
Using template \$_DFFE_PP0P_ for cells of type $_DFFE_PP0P_.
Using extmapper simplemap for cells of type $lut.
Using template \$_DFF_P_ for cells of type $_DFF_P_.
Using extmapper simplemap for cells of type $logic_not.
No more expansions possible.
<suppressed ~1355 debug messages>

yosys> opt_expr -mux_undef

3.153. Executing OPT_EXPR pass (perform const folding).
Optimizing module gost89_cfb.
<suppressed ~17366 debug messages>

yosys> simplemap

3.154. Executing SIMPLEMAP pass (map simple cells to gate primitives).

yosys> opt_expr

3.155. Executing OPT_EXPR pass (perform const folding).
Optimizing module gost89_cfb.

yosys> opt_merge

3.156. Executing OPT_MERGE pass (detect identical cells).
Finding identical cells in module `\gost89_cfb'.
<suppressed ~3810 debug messages>
Removed a total of 1270 cells.

yosys> opt_dff -nodffe -nosdff

3.157. Executing OPT_DFF pass (perform DFF optimizations).

yosys> opt_clean

3.158. Executing OPT_CLEAN pass (remove unused cells and wires).
Finding unused cells or wires in module \gost89_cfb..
Removed 0 unused cells and 3435 unused wires.
<suppressed ~1 debug messages>

yosys> opt_expr

3.159. Executing OPT_EXPR pass (perform const folding).
Optimizing module gost89_cfb.
<suppressed ~405 debug messages>

yosys> opt_merge -nomux

3.160. Executing OPT_MERGE pass (detect identical cells).
Finding identical cells in module `\gost89_cfb'.
Removed a total of 0 cells.

yosys> opt_muxtree

3.161. Executing OPT_MUXTREE pass (detect dead branches in mux trees).
Running muxtree optimizer on module \gost89_cfb..
  Creating internal representation of mux trees.
  No muxes found in this module.
Removed 0 multiplexer ports.

yosys> opt_reduce

3.162. Executing OPT_REDUCE pass (consolidate $*mux and $reduce_* inputs).
  Optimizing cells in module \gost89_cfb.
Performed a total of 0 changes.

yosys> opt_merge

3.163. Executing OPT_MERGE pass (detect identical cells).
Finding identical cells in module `\gost89_cfb'.
Removed a total of 0 cells.

yosys> opt_share

3.164. Executing OPT_SHARE pass.

yosys> opt_dff -nosdff -nodffe

3.165. Executing OPT_DFF pass (perform DFF optimizations).

yosys> opt_clean

3.166. Executing OPT_CLEAN pass (remove unused cells and wires).
Finding unused cells or wires in module \gost89_cfb..
Removed 0 unused cells and 70 unused wires.
<suppressed ~1 debug messages>

yosys> opt_expr

3.167. Executing OPT_EXPR pass (perform const folding).
Optimizing module gost89_cfb.
MAX OPT ITERATION = 1

yosys> abc -script /tmp/yosys_959hrK/abc_tmp_2.scr

3.168. Executing ABC pass (technology mapping using ABC).

3.168.1. Extracting gate netlist of module `\gost89_cfb' to `<abc-temp-dir>/input.blif'..
Extracted 1992 gates and 3156 wires to a netlist network with 1162 inputs and 300 outputs.

3.168.1.1. Executing ABC.
DE:   #PIs = 1162  #Luts =   537  Max Lvl =   5  Avg Lvl =   2.18  [   0.39 sec. at Pass 0]
DE:   #PIs = 1162  #Luts =   537  Max Lvl =   4  Avg Lvl =   2.18  [   2.54 sec. at Pass 1]
DE:   #PIs = 1162  #Luts =   537  Max Lvl =   4  Avg Lvl =   2.18  [   0.79 sec. at Pass 2]
DE:   #PIs = 1162  #Luts =   537  Max Lvl =   4  Avg Lvl =   2.18  [   1.29 sec. at Pass 3]
DE:   #PIs = 1162  #Luts =   537  Max Lvl =   4  Avg Lvl =   2.18  [   0.97 sec. at Pass 4]
DE:   #PIs = 1162  #Luts =   537  Max Lvl =   4  Avg Lvl =   2.18  [   1.21 sec. at Pass 5]
DE:   #PIs = 1162  #Luts =   537  Max Lvl =   4  Avg Lvl =   2.18  [   6.47 sec. at Pass 6]
DE:   #PIs = 1162  #Luts =   537  Max Lvl =   4  Avg Lvl =   2.18  [   0.52 sec. at Pass 7]

yosys> opt_expr

3.169. Executing OPT_EXPR pass (perform const folding).
Optimizing module gost89_cfb.

yosys> opt_merge -nomux

3.170. Executing OPT_MERGE pass (detect identical cells).
Finding identical cells in module `\gost89_cfb'.
Removed a total of 0 cells.

yosys> opt_muxtree

3.171. Executing OPT_MUXTREE pass (detect dead branches in mux trees).
Running muxtree optimizer on module \gost89_cfb..
  Creating internal representation of mux trees.
  No muxes found in this module.
Removed 0 multiplexer ports.

yosys> opt_reduce

3.172. Executing OPT_REDUCE pass (consolidate $*mux and $reduce_* inputs).
  Optimizing cells in module \gost89_cfb.
Performed a total of 0 changes.

yosys> opt_merge

3.173. Executing OPT_MERGE pass (detect identical cells).
Finding identical cells in module `\gost89_cfb'.
Removed a total of 0 cells.

yosys> opt_share

3.174. Executing OPT_SHARE pass.

yosys> opt_dff -nosdff -nodffe

3.175. Executing OPT_DFF pass (perform DFF optimizations).

yosys> opt_clean

3.176. Executing OPT_CLEAN pass (remove unused cells and wires).
Finding unused cells or wires in module \gost89_cfb..
Removed 0 unused cells and 2750 unused wires.
<suppressed ~1 debug messages>

yosys> opt_expr

3.177. Executing OPT_EXPR pass (perform const folding).
Optimizing module gost89_cfb.
MAX OPT ITERATION = 1

yosys> hierarchy -check

3.178. Executing HIERARCHY pass (managing design hierarchy).

3.178.1. Analyzing design hierarchy..
Top module:  \gost89_cfb

3.178.2. Analyzing design hierarchy..
Top module:  \gost89_cfb
Removed 0 unused modules.

yosys> stat

3.179. Printing statistics.

=== gost89_cfb ===

   Number of wires:                782
   Number of wire bits:           3948
   Number of public wires:          46
   Number of public wire bits:    3149
   Number of memories:               0
   Number of memory bits:            0
   Number of processes:              0
   Number of cells:                929
     $lut                          537
     adder_carry                    32
     dffsre                        360


yosys> opt_clean -purge

3.180. Executing OPT_CLEAN pass (remove unused cells and wires).
Finding unused cells or wires in module \gost89_cfb..
Removed 0 unused cells and 24 unused wires.
<suppressed ~24 debug messages>

yosys> write_verilog -noattr -nohex synthesized.v

3.181. Executing Verilog backend.
Dumping module `\gost89_cfb'.

Warnings: 1 unique messages, 1 total
End of script. Logfile hash: 24bf78e63c, CPU: user 6.63s system 0.10s, MEM: 75.94 MB peak
Yosys 0.18+10 (git sha1 a3cbfccc4, gcc 9.4.0-1ubuntu1~20.04.1 -fPIC -Os)
Time spent: 97% 6x abc (247 sec), 0% 31x opt_expr (2 sec), ...
real 62.57
user 237.92
sys 15.27
